reviewer_name,rating,date,visit_time,review_text
Bayu Gunawan,5,2 bulan lalu,Akhir pekan,"Eco Active Park (dulu Eco Green Park) adalah Wahana edukasi wisata berbasis keberlanjutan ekologi dan lingkungan yang direkomendasikan untuk dikunjungi. karena temanya adalah Eco Active yg berbasis lingkungan, maka yg disajikan bukan hanya wahana bermain tetapi lebih pada pendidikan lingkungan misalnya daur ulang barang bekas elektronik, pengolahan sampah, pelestarian hutan dan konservasi binatang. Ada bagian2 di tempat ini yg sangat sejuk dan teduh karena adanya rumpun-rumpun bambu dan mini hutan jati. Tersedia tempat penjual makanan yg tertata rapi dan bersih dengan harga yang normal (jika dibandingkan dengan yg dijual di luar). Bahkan, ada mini outdoor foodcourt yg sangat teduh berlantai hijau dan ada aneka burung termasuk merak yg bisa berinteraksi dengan pengunjung secara langsung. Toilet juga bersih. Foodcourt yg lebih besar juga tersedia dengan beragam pilihan makanan. Harga tiket masuk tergolong standar. Eco Active tetap bisa dijadikan rekomendasi untuk wahana edukasi berbasis lingkungan."
Atikerzs,5,2 bulan lalu,Hari biasa,"Wajib banget kesini untuk yg mau ngajak anaknya jalan jalan sekalian ngasih edukasi tentang hewan hewan. Banyak banget macam macam hewan yang ada disini, mulai dark hewan ternak sampai hewan laut seperti pinguin. Selain berbagai macam hewan, eco active park juga menyediakan aneka permainan permainan seru, dan sudah pasti ada kolam renangnya juga. Harga tiket masih tergolong standart ya tidak mencapai 100rb , jadi buat yg pingin ngajak keluarga jalan jalan, cobain ke eco active park ini."
FeiFei ADH,5,sebulan lalu,Akhir pekan,"Ini adalah taman yang memungkinkan kita lebih dekat dengan hewan. Di pintu masuk kita bisa bermain dengan kelinci, llama, capybara, kambing dll. Bisa beli makanannya Rp. 10.000. Overall kita lebih banyak berinteraksi dengan berbagai macam burung mulai dari macao hingga elang dan burung hantu. Disini ada juga untuk pembuatan biogas dari kotoran sapi yang difermentasi dan diambil gas metana nya. Harha tiket weekend nya Rp. 80.000"
vionaa,5,5 bulan lalu,Akhir pekan,"Saya berkunjung kemari karena acara Outdoor Learning dari sekolah saya bulan lalu. 🙆 Waktu itu, cuaca sedang hujan rintik-rintik, jadi hawa yang dibawakan sejuk dan dingin. Tetapi saya bersama teman-teman saya akhirnya rempong membawa payung hehee. Tempatnya sangat luas, kaki saya sampai pegal untuk sekedar berjalan mengelilingi bagian satwa. Mungkin saya saja yang tidak terbiasa berjalan kaki jauh. 😇🙏"
Hafidh Chru,5,3 bulan lalu,Akhir pekan,"Theme park di kawasan kota Batu, satu komplek dengan Jatim Park 2. Sangat recommended untuk edukasi anak TK dan SD mengenai hewan-hewan binatang mulai hewan ternak, ikan, hingga aneka burung (mayoritas hewan jinak). Harga masih worth it, weekday 40.000 dan weekend 60.000 sepadan dengan pelayanan dan wahana edukasinya. Dan tiket ini adalah tiket terusan, jadi semua wahana gratiiiis. Satwa yang dibawakan sangat beragam, Tempatnya asri, banyak pepohonan rindang dan tanaman lebat, membuat pengunjung serasa lebih dekat dengan alam, karna tempat didesain seperti habitat asli hewan. Kita juga bisa mendapatkan edukasi tentang batik, informasi mengenai stalaktit dan stalakmit, serta simulator gempa, angin, dan tsunami. Saran untuk manajemen eco active park, kandang kaca burung mohon dibersihkan, dan pembersihan kandang sebelum para pengunjung datang, saran untuk di tambah lagi wahana yang bersifat fun, dan tetap berinovasi setiap tahunnya. Area wisata sangat luas, jadi siapkan stamina yang prima untuk menjelajahi semua wahana disini, dan recomend datang disini saat pagi hari. Semoga bermanfaat, baarakallah"
Arfiany Nur Amalia,5,3 minggu lalu,Akhir pekan,Tempat yang sangat menarik dan menyenangkan untuk dikunjungi bersama keluarga maupun teman.
Anggi Puspita,5,2 bulan lalu,Hari biasa,"Buaguss polllllll... tiap wahana banyak yg free tanpa bayar2 lagi.. jd cocok banget buat kaum kaum sprti saya 😁 hewan2nya jg bagus2 terawat, wahana jg banyak bnget anak ga bakal badmood. Kolam renang ada, afa tour guidenya jugak."
Baihaqi Asmoro,5,sebulan lalu,Akhir pekan,"Begitu masuk ke area Eco Active Park, kesan pertama yang terasa adalah semangat eksplorasi dan kreativitas. Ada banyak spot tak terduga dan wahana interaktif yang membuat kamu terus penasaran. Tempat ini seperti dirancang untuk membebaskan sisi anak-anak dalam diri kita—banyak sudut yang menghibur, aneh, dan pastinya sangat Instagramable. Kesan paling kuat? Tempat ini sangat mengajak kita untuk bergerak dan bersenang-senang. Ada banyak aktivitas fisik ringan hingga ekstrem, tapi tetap menyatu dengan alam. Dan, karena terlalu asyik main, jalan-jalan, tertawa, dan nyobain wahana, kamera pun terlupakan—kecuali satu momen lucu bareng mobil yang nempel di langit-langit! Oh iya htm untuk weekend 90rb per orang jadi jangan lupa siapin uangnya ya atau tabungan sisa thr kemaren."
Andri Sutrisno,5,5 bulan lalu,Akhir pekan,"So far ini Zoo terbaik versi saya bila dibandingkan dengan kebun binatang di Jakarta. Terdapat hewan-hewanmyang jarang saya temui, posisi hewan sangat dekat dan kita bisa memberi makan hewan. Sayang sekali saat kita kesana hujan deras. Hebatnya disini terdapat wahana permainan free, puas banget kesini. Doakan kami kembali lagi ya :)"
Delyananti,5,5 bulan lalu,Hari libur nasional,"Pertama kali kesini waktu tahun 2022 masih dengan nama eco green park, sekarang udah ganti eco active park. Tempatnya gak begitu luas jadi gak terlalu capek dan bisa menikmati semua hewan2 yg ada di dalamnya. Tiketnya juga murah 😉 Semoga kedepannya bisa lebih berkembang."
Dika Cahyana,5,2 minggu lalu,Akhir pekan,Bagus tpi siapkan fisik dan tenaga anda.. Perjalanan wisata jauh.. Kalo pingin gk cape sewa ebike 150k per 3jam..
Ignasius Willyanto,5,5 bulan lalu,Hari libur nasional,"Pendapat Pribadi! Kunjungan kedua kali, dan ini beli tiketnya sepaket dengan Jatim Park 2 (Batu Secret Zoo).. Konsepnya menarik, memanfaatkan barang bekas yang dijadikan karya seni.. Layout tempatnya juga bagus.. Yang paling ingat dari tempat ini adalah banyaknya jenis burung Kakaktua, burung hantu, elang, dll"
Bowo Ardianto,5,6 bulan lalu,Hari libur nasional,"Destinasi wisata yang cocok buat keluarga, utamanya anak-anak. Unsur edukasi nya kental sekali. Mengajak anak berkeliling disini sangat bermanfaat mengembangkan pengetahuan mereka. Laboratorium yang ada di dunia nyata. Koleksi cukup banyak dan lengkap. Menambah poin plus ketika mengunjungi JTP2. Berhubung area nya cukup luas maka stamina yang prima diperlukan biar bisa jalan-jalan tuntas mengelilingi eco green park."
Sanni Zee,5,8 bulan lalu,Hari biasa,"Manajemen benar-benar totalitas dalam maintenance dan pengadaan spot-spot edukasi. Keren banget sih. Tapi kalau kata saya, ini lebih cocok digunakan outbound/outing class anak SD-SMP, kalau untuk anak TK selain fisik yang bener-bener terkuras juga waktu yang kurang sat-set karena yang dibawa anak under 6th semua ya, jadi ada spot yang harus dipilih untuk ditinggal demi efisiensi waktu. Tingkat kemandirian belum mumpuni. Tapi tetep sih keren banget, buat anak TK pol senengnya karena setiap mata memandang semua bernilai edukasi. Harga oke lah ya masih worth it sama pelayanan dan kesan edukasinya. Untuk makanan di food courtnya termasuk masih normal dan enak sih. Cocok buat anak-anak. Eh lagi semua wahana gratis loh. Kecuali ada beberapa yang berbayar tapi gak banyak kok. Kalau buat orang tua yang udah sepuh lebih baik sewa e-bike deh bener, teklok kaki. Wkwkwkwkw. Tiket Masuk 65.000 Paket outbound 95.000 Lunchbox 20.000"
Diah Dekamuslim,5,6 bulan lalu,Hari libur nasional,"Menyenangkan sekali ke Eco Green Park bareng keluarga. Anak-anak senang, ortu juga ikut bahagia. Di sini terdapat binatang mulai hewan ternak, ikan, hingga aneka burung. Banyak replika benda/patung dari barang-barang bekas, berbagai wahana dengan memanfaatkan barang bekas, rumah terbalik, dll. Ada juga kolam renang. Ada mushala, toilet, foodcourt, kios jajanan, dll. Intinya fasilitas lengkap. Kalau ke sana sebaiknya sejak pagi, sehingga waktunya cukup untuk mengeksplorasi seluruh area dan wahana di sana 👌"
Siti Balkis,5,7 bulan lalu,Hari biasa,"Salah satu wahana di Jatim Park 2 yang menawarkan edukasi tentang gaya hidup ramah lingkungan sekaligus bermain dan berinteraksi bersama satwa. Satwa yang ada di sini ada aneka burung dan unggas, serangga, domba, sapi, kelinci, kuda poni, rusa, berang-berang, primata, hingga pinguin. Bisa animal feeding dan ada animal show juga. Ada juga zona edukasi kebudayaan tentang miniatur candi hingga mempelajari batik. Di Science Center, kita dapat belajar mengenai stalaktit dan stalakmit, serta simulator gempa, angin, dan tsunami. Tidak lupa seperti di semua wisata Jatim Park Group, selalu ada wahana permainan gratis. Kalau cape berjalan kaki, ada penyewaan ebike. Disarankan juga membawa stroller buat yang membawa balita karena area Eco Green Park sangatlah luas. Sayangnya, dibanding kunjunganku ke sini di tahun sebelum pandemi, ada beberapa zona yang sepertinya kurang terawat. Buat yang memang ingin berkunjung ke Jatim Park 2, disarankan beli tiket bundling karena lebih murah. Aku nginap di Pohon Inn karena memang ingin menjajal semua wahana JTP 2. Bagi tamu yang menginap di Pohon Inn, tiket yang dibeli di sini berlaku 2 hari, kecuali Eco Green Park yang hanya berlaku di hari pertama pembelian tiket. Jadi, di hari pertama aku berkunjung ke Eco Green Park & Museum Satwa, lalu di hari ke-2 ke Batu Secret Zoo & Sweet Memories Selfie. IG: tracemyfootprints"
Lin Cuys,5,2 bulan lalu,Hari biasa,"Aaarghhh kembali lagi ke jatim park2,setelah hampir 6tahun lalu Kenapa pilihan nya kembali ke jatim 2? Karena mau liat binatang nya lagi,dibanding yang baru sepertinya saya tetep paling fav di jatim2 Harga tiket weekday 150k/person+terusan *Eco park+jatim2+museum+memories selfie Tempat tetap jempol.bersih n terawat Semua binatangnya sehat dan harga makanan nya di dalam situ juga murce Dari pagi sampe tutup baru selesai kita jalanin jatim2,sangat wprth every penny kata suami yang baru pertama ngikut ke jatim park"
puspita ica,5,5 bulan lalu,Akhir pekan,"cocok buat edukasi anak"" banyak binatang & pelajaran🥰 kemarin kesana agak sepi jadi enak buat njelajah"
Idris Efendi,5,setahun lalu,Akhir pekan,"Eco Green Park di Kota Batu adalah destinasi wisata yang asyik buat kamu yang ingin menikmati liburan sambil belajar tentang alam dan lingkungan. Tempat ini nggak cuma menawarkan pemandangan hijau yang segar, tapi juga banyak wahana edukatif yang seru untuk dikunjungi. Pas banget buat kamu yang pengen refreshing sambil menambah wawasan. Masuk ke dalam Eco Green Park, kamu akan disambut dengan berbagai macam taman tematik, seperti Taman Burung yang penuh dengan berbagai jenis burung eksotis. Di sini, kamu bisa melihat burung dari dekat dan bahkan memberi makan mereka. Ada juga Taman Hydroponic yang bakal bikin kamu paham gimana cara bertani modern tanpa tanah. Menarik banget, kan? Kasih makan: 5k/spot Harga Tiket: 70k Minuman : 10k-50k"
SiNyoman AWww,4,2 bulan lalu,Akhir pekan,Good blul sempet masuk keburu hujan jdi ambil yg di dalam ruangan saja.
Septian Eko N,5,4 minggu lalu,Hari libur nasional,"Eco Active Park, sebelumnya dikenal sebagai Eco Green Park, adalah destinasi wisata edukatif yang terletak di kawasan Jatim Park 2, Kota Batu, Jawa Timur. Tempat ini menggabungkan konsep pelestarian lingkungan, interaksi dengan satwa, dan teknologi ramah lingkungan dalam satu kawasan seluas sekitar 5 hektar. Dengan lebih dari 35 zona edukatif, Eco Active Park menawarkan pengalaman belajar yang menyenangkan bagi seluruh anggota keluarga. Salah satu daya tarik utama di Eco Active Park adalah koleksi lebih dari 1.000 spesies burung eksotis dari berbagai belahan dunia, seperti flamingo, kasuari, emu, dan elang. Pengunjung dapat berinteraksi langsung dengan burung-burung ini melalui sesi pemberian makan dan pertunjukan burung yang diadakan sepanjang hari. Selain itu, terdapat wahana edukatif seperti simulator gempa dan badai, yang memberikan sensasi nyata dan mendidik tentang fenomena alam. Fasilitas pendukung di Eco Active Park cukup lengkap, termasuk area parkir luas, mushola, toilet bersih, food court, dan penyewaan e-bike untuk memudahkan eksplorasi area yang luas. Harga tiket masuk bervariasi, mulai dari Rp50.000 untuk hari biasa hingga Rp80.000 untuk akhir pekan. Tersedia juga paket bundling dengan Jatim Park 2 seharga Rp150.000–Rp170.000, yang memungkinkan pengunjung menikmati lebih banyak wahana dalam satu kunjungan. Dengan kombinasi antara edukasi, hiburan, dan pelestarian lingkungan, Eco Active Park menjadi destinasi wisata yang ideal bagi keluarga yang ingin menghabiskan waktu berkualitas sambil belajar dan bersenang-senang. Kunjungan ke tempat ini tidak hanya memberikan hiburan, tetapi juga menanamkan kesadaran akan pentingnya menjaga lingkungan dan keberagaman hayati."
punya nana fikri,5,7 bulan lalu,Hari biasa,"tempat wisata keluarga yang recommended dan murah. cocok untuk wisata edukasi bagi anak-anak. selain itu disini juga ada wahana. hewan-hewan yang ada disini juga cukup terawat, didominasi jenis burung dulu dateng kesorean jadi udah sepi bangett dan udah banyak wahana yang tutup."
Made Nias,5,4 bulan lalu,Hari libur nasional,"Tempat wisata di Batu Malang yang penuh dengan edukasi, tempat berlibur yang cocok dengan keluarga 👍🏻👍🏻👍🏻"
Hidayatullah Almaududi,5,2 bulan lalu,Akhir pekan,Taman edukasi yg cukup lengkap. Dengan atraksi burung yg keren.
Nina Dawson,5,setahun lalu,Hari biasa,"Kesini udah 3x dan keliatan sih perkembangannya. Bagus, bersih dan edukatif. Kesini bersama rombongan sekolah jd enjoy banget ga berasa capek karena rame2. Syg, kolam renangnya kecil jd ga cukup utk menampung byk anak, apalagi kalo jadwalnya barengan 4-6 sekolah. Semoga next bisa diperbesar kolam renangnya."
Habibi Fahmi,5,setahun lalu,Hari biasa,"Very recommended !!! Kesana pas weekday, 65k per org, anak2 tinggi diatas 85cm sudah kena tiket. Harga segitu termasuk murah Krn semua wahana gratis termasuk water outbound utk anak2, hanya 2 wahana terbaru yg berbayar. Hewannya didominasi burung/unggas, bagi penggemarnya ini adalah surga dunia, dimana lagi bisa makan jajan ditemani merak, lihat black swan, dan bermacam burung/unggas exotic dari seluruh dunia. Kondisi hewan2nya cukup terawat, lingkungannya juga cukup bersih, ga terlalu bau, meskipun terdapat kotoran unggas di bbrp spot, pokoknya hati2 aja biar ga kena ranjau. Ada persewaan e-bike juga bagi yg ga kuat jalan, Krn rutenya lumayan jauh. Ada atraksi burung di jam2 tertentu, dan bbrp spot edukasi, sangat cocok utk pelajar SD."
alhafidzah story,2,8 bulan lalu,Hari biasa,"Sebenarnya tempat nya sangat mengedukasi sekali banyak burung² dan hewan lain dari seluruh dunia. Tapi pliss dong tempat nya lebih di rawat lagi bau banget dan banyak tikus di kandang² hewan. Banyak juga mainan yg tidak bisa di mainkan, air kolam renang nya kotor banget. Pas aku kesana kondisi nya sepi pengunjung dan masih banyak sekali sport² yang perlu di perbaiki. Tolong dong di perbaiki lagi dari segi semua nya biar kita para pengunjung juga lebih nyaman ."
Diza Permatasari,5,setahun lalu,Hari biasa,"Tempat wisata di JatimPark 2. Biasa didatengin rombongan anak2 sekolah 🙂👍 Lokasinya masih lumayan kaki friendly dibanding secret zoo alias ga terlalu besar2 banget tapi masih okelah untuk tempat wisata edukasi. Kebanyakan binatangnya itu jenis unggas sih ya kayaknya. Cukup menyenangkan dan edukatif sih. Ada banyak tempat main yg gratis buat anak2 tp ada jg yg bayar sih kayanya ya. Kmrn ga ada penyewaan stroller kaya di secret zoo, adanya cuma ebike aja, padahal lagi butuh banget 🥹 Ohiya, di sini ada water outbond. Jadi kaya kolam renang tapi versi kaya outbond gitu bukan yg bener2 kolam renang. Saran aja sih, kalo rencana mau main di kolam renang mending bawa payung buat shading pas nungguin anak2 main. Soalnya tempat nunggunya terbatas dan kalopun ada tempat yg agak luas untuk duduk dan naro pakaian dia ga ada atapnya, apa ga mateng itu 😭"
Emir Bagus2212,5,11 bulan lalu,Akhir pekan,"Pengalaman saya mengunjungi destinasi wisata ini... Kekurangannya menurut saya musholla nya terlalu kecil untuk menampung kapasitas pengunjung apalagi saat weekend. Slebihnya bagus & perlu ditingkatkan, mantap untyk manajemennya"
Vina Pillow,5,setahun lalu,Akhir pekan,Tempat liburan yang asik buat keluarga. Apalagi kalo ngajak anak² pasti seneng liburan disini. Fasilitas lengkap dan bersih. Semua wahana aman buat anak². Ada banyak wahana gratis. Binatang² nya terawat dan cukup menghibur anak². Boleh bawa makanan dan minuman dari luar. Banyak spot edukasi buat anak². Kesini pas hari minggu harga tiket 70rb perorang. Pokoknya seru liburan disini
Lisa Smith,5,2 bulan lalu,Hari biasa,"Tempat nya lumayan bersih,banyak burung2 nya,,aku kesana GK pas weekend jdi lumayan agak sepi 😁"
Joko Susilo,4,setahun lalu,Hari libur nasional,"tempat wisata edukasi untuk anak karena cukup lengkap koleksi binatang dan museum satwa kecil di dalamnya, kokeksi burung cukup banyak, fasilitas lumayan juga, akses jalan dari masuk hingga keluar kemarin kira kira hampir dua jam eksplor, untuk tiket dengan harga segitu cukup worth it, 80 ribu. Anak lumayan senang dan capek juga. Kalau mau lebih hemat beli paketan terusan sama secret zoo juga boleh asal masih banyak waktunya."
Eka Rosdiana,3,setahun lalu,Hari libur nasional,Overall sangat menyenangkan karena ada tempat main untuk anak-anak juga dan pertunjukkan burung.. Semoga bisa lebih ditingkatkan lagi kebersihan dan makin terawat beberapa wahananya..
Gitakara Ardhytama,4,2 tahun lalu,Hari libur nasional,"Review saya untuk kunjungan tanggal 24 April 2023: 1. Pemesanan tiket masuk bisa dilakukan secara online di beberapa aplikasi travel yang sudah terkenal. Karena high season saya beli tiketnya di harga 75.000 per orang. 2. Saya datang ke sana sekitar jam 9 pagi. Masih agak sepi saat saya datang. Loket tiket belum terlalu penuh dengan antrian. Lokasi parkir cukup dekat dengan loket dan lapangan parkirannya juga luas. 3. Ada persewaan e-bike di depan setelah melewati pintu masuknya. Semua e-bike bertipe single seater dan harganya 150.000 per unit. 4. Isi satwa2 di dalamnya mayoritas unggas, hampir 95% satwa yg ada di dalam adalah unggas. Ada beberapa satwa yg dilepas liarkan, berjalan2 ke sana kemari di sekitaran rute perjalanan pengunjung. Ada beberapa titik yg mengijinkan pengunjung memberi makan dan berinteraksi dengan satwa yg ada (tentunya makanan yg sudah mereka sediakan dan didampingi pengawas satwanya). 5. Toilet tersedia banyak di sekitar rute wahana, untuk kebersihan toilet cukup bagus. Bersih dan airnya selalu ada. 6. Banyak area food court di dalam, tetapi ada beberapa titik yang di depan food courtnya terdapat hewan2 yg berkeliaran dan “minta makan” kepada pengunjung yg datang ke food court. Bahkan saya menemukan tempat duduk di depan sebuah food courtnya yg penuh dengan (maaf) kotoran unggas. Maaf, itu agak mengganggu selera makan saya saat itu dan saya jadi memikirkan kembali soal kebersihan makanan yg saya beli. 7. Untuk soal kesejahteraan hewan mohon lebih diperhatikan lagi, apalagi saat high season atau akhir pekan. Saya sempat melihat ada ikan yg mati mengambang di salah satu kolam ikan. Ada juga saya melihat burung yg sepertinya sedang sakit (atau kesakitan) dan menyendiri, karena saya lihat PARUH ATASNYA HILANG. Entah karena pertengkaran antar burung yg satu kandang dengannya atau bagaimana, saya kurang tahu. Karena saat saya ingin memberitahu petugas tidak ada petugas yg berjaga di sekitaran deretan kandang itu saat itu. Ada pula beberapa burung yg saya lihat dikurung dalam sangkar yg lebih kecil lagi. Jadi ada kerangkeng kecil yg berisi burung di dalam kandang itu. Kandang di dalam kandang, kalo boleh saya sebut begitu. Ada beberapa kandang yg kosong juga saya lihat, entah kemana hewannya."
N,5,3 bulan lalu,Hari libur nasional,sangat seru dengan membawa keluarga
nurrohmah abduljamil,4,setahun lalu,Hari biasa,"Konsepnya bagus,satu pengelola dengan Jatim Park,disini adalah jenis burung dengan area 14hektar siapkan energi untuk berkeliling melihat koleksi burung2 baik khas Indonesia maupun yg dari luar negeri,cukup bagus untuk edukasi,ada kolam renang,ada atraksi elang,dan tidak boleh bawa makanan+minuman masuk ya,ada banyak Foodcourt dengan sistem pembelian kupon dicashier terpisah (memang agak ribet sih KLO sistem ini) dan baru kita bawa ke penjual yg mana mau kita beli,"
Lika Lindyasari,5,setahun lalu,Akhir pekan,"Masih di area sekitar jatim park 2, konsepnya minizoo feeding animal, dan lebih ke pengenalan berbagai jenis burung atau unggas. Cocok untuk jalan ringan santai, ada beberapa spot edukasi dan wahana juga."
Isma Hafidh Rosidah,5,setahun lalu,Akhir pekan,"Tempat wisata edukasi yang memiliki banyak wahana menarik. Koleksi burung yang dimiliki lengkap dan banyak, mulai dari yang biasa kita lihat sehari-hari hingga burung² langka, dan semuanya terjaga dengan baik. Terdapat beberapa spot edukasi yang menarik dan modern. Sebagian besar wahana dapat dimasuki gratis (sudah include tiket masuk di awal). Saat ini juga sudah terdapat beberapa wahana baru yang tak kalah menarik. Tempat yang sesuai untuk wisata keluarga maupun field trip. Selain wahana yang lengkap, fasilitasnya juga lengkap, ada mushola, toilet, food court yang luas, dan tempat sampah pilah sehingga lingkungannya juga tetap bersih."
Dhanial Multazam,5,setahun lalu,Hari biasa,Banyak sekali variasi dan jenis burung disini. Ada banyak burung yang diawetkan yang di jadikan pajangan pada 1 ruangan. Tempatnya luas dan tertata. Ada wahana permainannya. Sangat direkomendasikan untuk tempat wisata di batu.
toni wira,5,6 bulan lalu,Hari libur nasional,sangat bagus dan sangat nyman untuk membawa keluarga harga tiket juga terjangkau
destia cardinalia,4,setahun lalu,Hari biasa,"Sengaja niat kesini Beli tiket on the spot tdk terusan daann di info bahwa hr jumat itu termasuk weekend. Padahal jumat kan masih hari kerja , how come dude ? Jd ya ngikutt aja dehhh ktentuannya beli tiket hrga weekend 75k/org Sbenarnya worthed utk lokasi dan wisata ddlmnya , hewan”nya jg jinak apalagi ada kakaktua yg bs ngomong saat ddekatin . Namuunn eco green park ini termasuk sepi bgt dibanding wisata jatimpark yg lain pdhl dsini bnyk bgt ilmu dan info yg ddpt loh, jd kalo kesini utk wisata edukasi pdhl kalo dgn keluarga dan anak” kan bs belajar sekaligus bermain . Diinfo petugas tiket ddpan tetap ada penampilan show tapii pas uda ddlm trnyata zonk , nanya petugas katanya krna sepi pengunjung jd show dtiadakan. Lahh bs gitu ?? Sbenrnya mau sepi ga sepi ya show must go on kann , pdhl cuaca cerah krna anak” nungguin bgt bird prey shownya,kecewa sih. Di akhir pas mau keluar terdapat wahana hanoman 3D dan kereta about life , baguss sihh dan belom termasuk htm jd beli lg utk wahana ini tapii sebelum masuk lagi lagi dsini ptugas tiket wahana menjelaskan kalo tiket promo 2 wahana bs dpat potongan itu berlaku hnya saat weekend ( lah emg kan ddpan saya beli htm yg weekend ,gmn sih ) dann ternyata hny berlaku sabtu minggu dong promonya 😌 beli tiket 2 wahana jd 25k yg seharusnya masing” 15k dan 20k . Tolong ya utk manajemen diperjelas lg, ketentuan weekend dan weekday Dimana” hr jumat tdk terhitung weekend apalagi masih hr kerja dan saat qt kesini belom termasuk high season . Ddlm bnyk foodcourt namun hny sedikit yg buka alhasil cumn beli gorengan . Tolong manajemen dikelola lg dgn baik ini eco green parknya -krna bnyk yg ga ssuai saat ddlm."
Vieka Alana,5,setahun lalu,Akhir pekan,"Kesini lagi setelah sekitar 10th an.. Banyak sekali perkembangannya. Koleksi yang paling menarik adalah aneka ragam unggas, dan burung. Pengunjung bisa merasakan sensasi di alam dg masuk ke dalam aviary burung nuri, burung elang dsb. Wahana peternakan dan juga pet feeding Beli tiket terusan utk jatim park 2 seharga 170k pada weekend. Datang pagi hari lebih baik karena eco green park tutup lebih awal dr wahana yg lain.."
Amin Sunarko,5,setahun lalu,Akhir pekan,"Tiket cukup terjangkau. Cuma sangat disayangkan, banyak wahana yang tidak berfungsi karena kurangnya perawatan. Beberapa kandang juga terlihat kotor, banyak tikus juga di kandang burung . Parkir cukup luas. Harga makanan cukup terjangkau. Terima kasih"
santya devi,5,11 bulan lalu,Hari biasa,"Di eco green park ini lebih banyak ke unggas sih dan banyak benda2 daur ulang, masyaa Allah banyak juga jenis burung di dunia. Yg terpenting anak2 pada happy semua 😁🥰"
Nia Dara Sucita,5,setahun lalu,Hari biasa,
Jusak Hadi,4,setahun lalu,Hari biasa,"Sudah agak kurang terawat ya dibanding terakhir kesana, mungkin karena efek pandemi covid. Petugasnya ramah2, cuma kemarin anak saya pengen beli strawbery tapi tidak ada petugasnya. Wahana bermainnya cuma sedikit tp sekarang ada tambahan playground buat anak2."
Hendra Afiyanto,5,setahun lalu,Akhir pekan,"Lokasi strategis dengan fasilitas parkir bersih dan luas. Fasilitas toilet juga bersih dengan jumlah banyak tersebar di dalam dan luar lokasi wisata. Harga tiket normal dengan wahana yg banyak sekali dan sangat menarik. Bisa membawa makanan ke dalam lokasi wisata. Staff wisata ramah dan responsif. Harga makanan terjangkau, mulai dari camilan hingga makanan berat."
dewi apriliana,5,setahun lalu,Akhir pekan,"Eco Green Park ini letaknya di sebelah Batu Secret Zoo satu area di Jatim Park 2. Jika beli tiket terusan, bisa langsung masuk tanpa beli tiket lagi.Luaaaas banget! Siapkan fisik kaki yang super fit agar puas mengeksplor tempat ini. Tidak hanya sekedar kebun binatang, Eco Green Park juga bisa jadi sarana edukasi. Kalau binantangnya menurut saya lebih lengkap koleksinya di Batu Secret Zoo. Tapi kelebihannya di Eco Green ada banyak sarana edukasi."
