reviewer_name,rating,date,visit_time,review_text
Adriano Emmanuel,5,10 bulan lalu,Akhir pekan,Seruuu gesss bisa refreshing liatin hewan n tanaman sekaligus belajar
LaFRAN AFFANDY,5,setahun lalu,Akhir pekan,Edukasi Fauna yg lengkap dan cocok untuk Anak-anak dan Dewasa
Zi Nugraha,3,2 tahun lalu,Hari biasa,"WCnya jauh sekali , minimal tiap 50m. Tidak cocok buat anak SD kelas 2 kebawah"
rachmat jaya,5,setahun lalu,Hari biasa,rekomen pecinta burung banyak sekali burungnya bisa langsung kasih makan burung.
Yolanda Aurelia Cahyono,5,2 tahun lalu,Akhir pekan,
Setio Tri U,5,setahun lalu,Akhir pekan,Cocok untuk wisata edukasi bersama anak anak
Mahya rizka Virgia damayanti,3,3 tahun lalu,Hari biasa,"Lumayan sih capek.jalannya.. Food courtnya lmyan ribet ya harus pake card dan top up, musholla hnya satu dan kecil. Tmpt wudhu dan toilet juga kecil.. Pdhl pengunjung rameee bnget"
Putri Lia,5,2 tahun lalu,Hari biasa,Si kakak happy bisa lihat dan belajar tentang berbagai macam burung.
Awan asyahdam,5,2 tahun lalu,Hari biasa,Bagus bersih...nyaman pokoknya puas jln2 kesini
Alifah Nanda,4,2 tahun lalu,Hari libur nasional,"Overall mantap, keren abiz😁🙏🏽 tapi minta tolong untuk mushola supaya dapat perawatan yg sama baiknya ☺️ 🙏🏽 supaya liburan dan ibadah juga sama2 nyaman ☺️🙏🏽"
Rima Titianingtyas,5,2 tahun lalu,Hari libur nasional,happy place sih buat anak2 maupun buat bapak ibu hehe 💕
Tutut Oktavia,2,setahun lalu,Hari biasa,"Kurang menarik, masih banyak yg lagi direnov. kalo bosen atau mau pingsan sekali masuk gak bisa keluar, harus di telusurin sampe selesai."
faisal mochamad,5,2 tahun lalu,Hari biasa,"hay"" Guys untuk keluarga dan di utamakan para guru"" SD & SMP nih bnyk hal bs di pelajari nih di ECO GREEN PARK mlai mengenal jenis burung, pengolahan limbah sampah, jg ada masih banyak permainan anak"".... gak rugi deh kl ke sini tempat'nya hijau buwanget guyssss....!!!"
Wulan Dari,5,setahun lalu,Hari biasa,
Teddy Lee,5,3 tahun lalu,Akhir pekan,"Asik nih tmpt nya, luas bgt.. and binatang jg terawat and keren..."
Kopi Pahit,5,setahun lalu,Hari biasa,Lokasinya luas dan menakjubkan cocok untuk pembelajaran bagi pelajar karena berisi bermacam macam satwa .
Umi Kulsum,5,2 tahun lalu,Akhir pekan,Wisata edukasi tentang hewan dan tentang alam. Sangat menyenangkan
Lisa Wahyudiana Putri,5,6 bulan lalu,Hari biasa,"Sayang banget ga sempet kesini karena udah sore, perjalanan pulang lama banget makanya ga sempet kesini padahal udah beli tiket terusan 😭"
Ditya Permana,5,2 tahun lalu,Akhir pekan,"Luaasss, gak cukup sehari buat muter, Bonus kura2 lagi asik asik"
Muliana Dewi,5,3 tahun lalu,Hari libur nasional,Kesini dengan keluarga lebih seru 😚
Eko Prasetyo Sugihartanto,5,9 bulan lalu,Hari biasa,"Weekday adalah waktu yang tepat untuk datang ke wisata ini bersama keluarga. Hehehe.... Lebih santai, lebih lega tanpa antri, pengunjung tidak banyak sehingga anak juga lebih puas dan bisa menikmati masing2 wahana yang disediakan."
Herianto Halim,4,3 tahun lalu,Akhir pekan,Harganya termasuk mahal dibandingkan dengan fasilitas nya. Pada saat berkunjung weekend Rp. 150.000. Anak-Anak dengan tinggi badan diatas 85cm bayar full. Beli lewat aplikasi Traveloka hemat Rp. 20.000
Olivia de pontoh,5,setahun lalu,Akhir pekan,Dengan harga 70.000 kita bisa liat satwa2 yg termasuk ramah dengan manusia Baru masuk langsung di suguhkan dengan flamingo
misterdokom,5,3 bulan lalu,Hari libur nasional,Mengenal alam sekitar kita dan hewan unggas yang ada di seluruh dunia.
Kartika tika,5,3 tahun lalu,Hari biasa,"Sedikit mahal menurut aku, tapi lumayan untuk pengenalan binatang"" bagi anak"""
Yunie Nita,5,2 tahun lalu,Hari libur nasional,Bagus buat para orang tua yg mau edukasi dan mengenalkan hewan2.karena disana bisa interaksi langsung dengan hewan2nya.
Bianconera Traveller,5,2 tahun lalu,Hari biasa,"Tempat wisata yg nyaman, bagus jg buat anak kecil krn banyak binatang yg sdh jinak bagus buat interaksi dg pengunjung dan menambah edukasi buat anak²"
fitri r tyas,5,2 tahun lalu,Akhir pekan,Taman Hiburan cocok buat anak2.
Freddy F Suhendra,5,3 tahun lalu,Hari biasa,Panjang jalannya... tapi well educated... anak2 puas dan ortunya cape... 😀😀😀
Muhammad Arkoun,5,3 tahun lalu,Akhir pekan,"Alhamdulillah,,Tempat wisata yang menarik mengedukasi menghibur dan nyaman untuk keluarga kecil maupun besar,pelayanannya baik ramah bersih dan aman"
silvana ratih,5,3 tahun lalu,Hari biasa,Tempat wisata di Batu yg sangat bagus buat lihat macam2 burung sama ada wahana barunya namanya FARMLAND yg bisa memberi makan para hewan2 disitu
Adi Sucipto,5,setahun lalu,Akhir pekan,Burung burung ayam unggas ada kambing mini juga
Diyah Mulyanah,4,setahun lalu,Hari biasa,Tempat yg bagus untuk edukasi anak tentang berbagai macam burung
erick susmitha,4,2 tahun lalu,Hari biasa,Wisata untuk anak2. Sewa sepedah listriknya cukup mahal. Weekdays 150K
Rendra Rezkia,5,2 tahun lalu,Hari biasa,"Tembat wisata yang sangat populer dikota batu, dengan lokasi yang sangat luas, cocok untuk edukasi anak. Mengenal banyak sekali jenis hewan,"
Gita Puspita,5,3 tahun lalu,Hari biasa,Tempat wisata yg cocok untuk bawa keluarga. Dilarang bawa makanan berat (nasi). Harga makanan didalam juga masih masuk akal. Misal es teh 6600 sdh sm ppn
Faricha Hanim,5,2 tahun lalu,Akhir pekan,Keren banget bagi pecinta unggas Sangat lengkap
ragil amenta,5,setahun lalu,Akhir pekan,"Menarik dan seru. Banyak wahana edukasi, cocok untuk belajar anak"
Aliyul Himam,4,2 tahun lalu,Hari biasa,Tempat yang bagus dan edukatif untuk wisata bersama keluarga atau bagi para pelajar
Chiva,5,2 tahun lalu,Hari biasa,Tempatnya bagus cocok buat rekreasi anak maupun keluarga😘
Ndari Setiya,5,2 tahun lalu,Akhir pekan,"Lumayan lah buat pecinta unggas,,tapi mungkin bisa ditambah wahana bermain anak. Luas banget tempatnya."
Lukman Baharudin,5,2 bulan lalu,Akhir pekan,Mantap tempatnya. Banyak spot edukasi didalamnya
Lydia Aprilia,5,3 tahun lalu,Hari biasa,Wisata edukatif anak. Cocok buat liburan alam bersama keluarga
Uly Dame Ria Ambarita,5,setahun lalu,Hari biasa,Wisata edukasi yg cocok buat anak2
Angga Pradikta,3,setahun lalu,Hari biasa,DiPanggung Bird Show panas ..kurang ada naungan Tanaman yg rindang.
Dwi Murdiono CS CS,5,3 tahun lalu,Hari biasa,"Sekarang sudah berekembang.. Dulu hanya kebun binatang, sekarang sudah banyak tempat main anak2.. Bagus.."
jumatullaila bjumatullaila@yahoo.com,4,2 tahun lalu,Akhir pekan,"Edukatif, keren... Inovatif. Sangat cocok sekali untuk liburan keluarga."
Alfan Chrisdianto,5,3 tahun lalu,Hari biasa,Ga jadi masuk...pas hujan deras😂😂
Devy Yulianto,4,setahun lalu,Akhir pekan,Diusahakan jangan musim hujan ya...hee
Ninoi Lita Ayu Prihantini,5,setahun lalu,Hari biasa,"Menyenangkan,banyak jenis burung yg bs d lihat"
Nida Husna,5,2 tahun lalu,Hari biasa,"Tempat edukasi yang baik , saran untuk petugas di pintu masuk lebih banyak supaya antrean tidak panjang"
ismanto youwono,5,2 tahun lalu,Akhir pekan,Hewan nya banyak khusus unggas tapi sumpah luas banget.. puas rasanya
Editha pratama Putra,5,2 tahun lalu,Hari libur nasional,"Taman yang asik untuk ajak anak2 ,luas juga dan hewanya lengkap, siip pokoknya"
Kang Aris Chanel,4,2 tahun lalu,Hari libur nasional,sayangnya gk boleh bawa jajan dari luar. dan harga jajananya super internasional harganya. air mineral 10k makanya cepet kaya wkwkwkwkwk.
aris imcsales,5,2 tahun lalu,Hari libur nasional,Tempat piknik cocok buat anak anak.. Bisa memperkenalkan aneka satwa.. Tempat bersih dan nyaman
Cak Moet,4,setahun lalu,Hari biasa,Wisata edukasi seru dan menambah ilmu.
Violeta Putri,5,3 tahun lalu,Akhir pekan,
anggita filans,4,setahun lalu,Akhir pekan,Bagus tapi utk pemeliharaan kandang kurang terawat.
Bagus Prakoso,4,setahun lalu,Hari biasa,"Kawasan wisata batu malang, biar ngga capek kelilingnya pake sepeda listrik, ada tempat pentas, ngasih makan binatang, bisa keliling bersama kawanan unggas atau burung, tempatnya perlu diperbaruhi agar terlihat bagus."
rahma pratiwi,3,setahun lalu,Hari biasa,"Saat outing class ke ECO Green Park Kami ambil paket education Melebihi jam buka yg telah terjadwal sehingga terjadi penumpukan pengunjung yg mengantre Untuk fasilitas outbound TIDAK ADA: -flying fox (guide tidak mengarahkan) -mandi busa Tergesa-gesa sehingga siswa tertinggal yg barisan belakang Sehingga peserta SANGAT KECEWA untuk hal ini Ada kuota pengunjung per hari ,sehingga tercapai pelayanan yg standart.Hasilnya adalah kepuasan pelanggan. Konsumsi SANGAT BAIK: -Isian menu -tingkat kematangan -ketepatan penyajian (Kec.buahnya ketinggalan) Saran untuk food court: Lebih baik bayar langsung tidak deposit Krena banyak pengunjung yang akhirnya tidak jadi membeli. Semoga management lebih memperhatikan hal ini. TERIMAKASIH ATAS RESPON BAIKNYA"
Ayu Cahya,4,setahun lalu,Hari biasa,"Rutenya cukup jauh, disarankan bawa stroller untuk yang membawa balita, didalam cukup banyak tenant makanan dan souvernir dengan harga terjangkau, kamar mandi bersih, untuk musholla hanya satu didekat kolam renang cukup besar, bersih, didalam disediakan e bike tpi saat sudah setengah perjalanan baru tersedia"
Elsa Novianandra,5,2 tahun lalu,Hari libur nasional,"wisata edukasi tntng hewan terlengkap di Jawa Timur, cocok utk bersama keluarga maupun orang tersayang"
Akhmad Faizal,5,3 tahun lalu,Hari libur nasional,Berada 1 kawasan dg Jatim park 2. Luas sekalee tempatnya. Cape jalan keliling menikmati beragam satwa disana. Untung ada disediakan e bike
Pujo utomo,5,setahun lalu,Hari biasa,"Josss banget, interaktif untuk anak, tempat terbaik di jp2"
helmy setyaprayogi,5,2 tahun lalu,Akhir pekan,"Tempatnya luas,binatangnya banyak. Capek kalau jalan kaki."
Sri Wulandari,5,2 tahun lalu,Hari biasa,"Tempat edukasi anak anak, nyaman jg untuk rekreasi, ramah anak"
Sih Parmawati,5,3 tahun lalu,Hari biasa,Tempat wisata ramah anak; ramah lingkungan; menyenangkan
indah dwiyanti,5,3 tahun lalu,Hari biasa,"Senang sekali,jadi tau berbagai macam unggas di seluruh dunia tanpa harus ke luar negeri"
Sigit Mahulana,5,sebulan lalu,Hari biasa,"Hotel , restoran yg jdi satu dengan kebun binatang"
Senangtrus TT Mania,4,2 tahun lalu,Akhir pekan,sangat menarik... hewan unggas nya banyak tp kl boleh saran.. perlu ada tambahan tempat makannya nih
fitria april,5,setahun lalu,Akhir pekan,"Tempatnya sangat bagus, cocok untuk berlibur berasama tmn dan keluarga, apalagi yang membawa anak kecil bisa bermain sambil belajar mengenai hewan"
Meitamiya Bening,4,5 tahun lalu,Meitamiya Bening,Tempat wisata edukasi... Buat pelajaran anak tentang flora dan fauna dan pengolahan limbah... Selain itu juga ada game dan kolam renang mini.
Uci Kusnandar,5,3 tahun lalu,Hari biasa,"Tempatnya nyaman,sejuk & sangat mengedukasi"
Feli rosa,5,3 tahun lalu,Akhir pekan,"Seru untuk anak- anak bisa mengenal berbagai jenis burning, ada permainan nya juga"
David Fernando,5,5 bulan lalu,Akhir pekan,Tempatnya bagus buat sarana belajar anak2
Sinta Nur R.d.a,5,2 tahun lalu,Akhir pekan,"Tempatnya bersih, nyaman, sejuk.."
Annissya Fuji,4,11 bulan lalu,Hari biasa,"Harga terjangkau, cocok untuk liburan bersama keluarga tp minusnya masih banyak fasilitas yg rusak, sehingga kita kurang puas semoga bs diperbaiki lagi"
DIDIK KN,4,setahun lalu,Hari biasa,Seruuu siiih buat para Bocil recommended looh..
Indah Sari,5,2 tahun lalu,Hari libur nasional,"4 area, tp eco green park ini yg buka duluan. Yang lain buka stengah 10"
Rudy Devianto,5,2 tahun lalu,Hari libur nasional,"Suasana nyaman dan cocok untukanak anak, banyak arena bermain gratis dan parkir luas"
Abul A'la El Maududy,5,setahun lalu,Hari biasa,Secara keseluruhan Eco Green Park adalah wisata edukasi di kota Batu yang masih bisa dibilang murah dengan makanan yang lumayan terjangkau untuk kota wisata banyak terdapat berbagai macam satwa dan tempat edukasi termasuk pengetahuan untuk anak-anak dan dewasa.
Herinanda Fahmy Fahlevie,5,11 bulan lalu,Akhir pekan,"Disini tempatnya menarik banget. Tempat yang cocok buat belajar sambil bermain untuk anak2. Harga tiket yang relatif murah, worthed banget pokoknya."
Ika Romadhoni Juwani Ningsih,5,3 tahun lalu,Hari libur nasional,"Happy banget, cuma capek soalnya jalan kaki."
Ajeng Putri,4,2 tahun lalu,Akhir pekan,"lumayan sih, kesana abis hujan jadi seger banget udaranya"
Endru Imawan,4,2 tahun lalu,Hari biasa,Sangat bagus untuk berlibur Umpan terlalu mahal
Iwan'Z Kuchiki,4,9 bulan lalu,Hari biasa,
Lucky Putra,5,setahun lalu,Akhir pekan,"Tempat yang cocok untuk belajar tentang hewan. Staffnya juga sangat ramah. Sayangnya koleksinya tidak terlalu banyak, kondisi kandang juga agak kurang, dan beberapa fasilitas, khususnya alat peraga, tidak berfungsi dengan baik."
John Alexander,4,setahun lalu,Akhir pekan,"Pada dasarnya merupakan perpaduan antara tempat liburan edukasi dan wahana rekreasi, dengan warung makan dan berbagai fasilitas penunjang bagi pengunjungnya. Basically, it's a combination between educational holiday spots and recreational rides, with food stalls and plenty of supporting facilities for the visitors. When you arrived, you will be pleased with animals from all families, including mammals (primates, rats, and other kind of mammal species), fishes and sea creatures, reptiles, and so much more. There are plenty of species provided by the Jatim Park Management group to see, and plenty of food stalls and drinks to offer. Not only educational spots, there are some recreational rides to enjoy. It's one of the most recommended for visitors from Surabaya or Malang. One of the most favourite holiday destination for East Javanese people. (EN🇬🇧🇺🇸)"
UD PERMATA,5,2 tahun lalu,Akhir pekan,"Sangat berkesan ,binatang lengkap,,,permainan lumayan komplit ,,,"
Yogi Gamawijaya,5,3 tahun lalu,Hari biasa,surga nya anak2... kalau terlalu banyak pengunjung kurang bisa menikmati
Agus Angler,5,2 tahun lalu,Akhir pekan,Fisik harus fit pokoke... Tempat edukasi putra putri kita
Arimas Prayogi,5,2 tahun lalu,Akhir pekan,Tempat yang pas untuk belajar dan bermain seputar dunia satwa
Fanofa,5,2 tahun lalu,Hari biasa,"Cape muternya. Karena abis dr eco green park, trs baru jtp berasa banget capenya."
Anindya Wardhani,5,2 tahun lalu,Akhir pekan,
AMAR PARK,4,2 tahun lalu,Hari biasa,Fun. Cocok buat edukasi. Permainannya lumayan banyak. Masjidnya lias.
Gibran Abyan Hardyanto,5,2 tahun lalu,Akhir pekan,"Tempatnya bagus dan bersib, binatangnya banyak, ada musium serangga jg."
aria tri,5,setahun lalu,Akhir pekan,"Wahana edukasi untuk anak yang lengkap , serta dii sediakannya pemandu yang ramah dan menguasai dalam pemahanman kepada anak, serta wahana wahana yang lengjap dan menarik untuk anak, juga jajanan yang tidak mahal walau di dalam lokasi tersebut"
Yesi Santika,5,2 tahun lalu,Hari biasa,Cocok banget buat anak anak liburan sambil belajar
Andi Wati,5,2 tahun lalu,Akhir pekan,Kebun binatang dg varian binatang yg byk
Feni ike kusuma,5,3 tahun lalu,Akhir pekan,"Luas bgt, satwa lengkap, udara sejuk, jajanan banyak, ok deh pokoknya."
Fransiska Sari,5,2 tahun lalu,Hari biasa,"Kunjungan kedua, datang saat siang menuju sore jadi udah lumayan sepi."
Asmin Kurniati,5,setahun lalu,Hari libur nasional,Bagus untuk edukasi anak.. Di sini banyak burung-burung dan satwa kecil yang menarik untuk anak-anak. Fasilitas memadai dan bersih. Cari makan juga mudah karena di dalam sudah ada foodcourt yang agak pricey dan rasanya so-so tapi paling tidak kita ndak usah keluar dari wahananya.
adib wiguna wiguna,5,2 tahun lalu,Hari biasa,Tempat nya bersih dan harga terjangkau
luh Mala,5,2 tahun lalu,Hari libur nasional,Tempat rekreasi dan edukasi untuk anak2
Izzatul Yaziddah,5,2 tahun lalu,Hari libur nasional,"Wisata edukatif,, bisa berinteraksi langsung dengan hewan, anak2 pasti senang berkunjung kesini..."
Vina Septiana W,5,setahun lalu,Akhir pekan,Untuk yg mau berwisata edukasi cucok buat baa anak2 buat ngajarin anak2 nama2 binantang dan lain2. Untuk tiket tdk jauh beda dengan wisata sebelahnya yaitu 150 kalau pas weekend kalau weekday 125rb overall saya menikmati setiap pemandangan yg disediakan disana.
Gerards,5,2 tahun lalu,Hari biasa,Ga usah ragu banyak burung dan edukasinya sesuai dengan judulnya
V O L V O,4,2 tahun lalu,Hari libur nasional,"Tempat sangat hijau, meneduhkan suasana hati. Kebetulan pas kesini cuaca hujan gerimis dan berawan, ditambah suhu yang sangat sejuk, luar biasa sangat nikmat sekali sambil naik e-bike muter2. Ada show burung sangat fantastis. Tapi sayang kondisi e-bike nya sudah sangat jelek, tidak ada peremajaan. Saya sewa e-bike 3 sekaligus, harus ganti batere beberapa kali karena jalan tidak kuat nanjak, terakhir mogok. Dan masih banyak orang merokok disini, padahal ini ruang ramah anak2. Petugas tidak tegas menghadapi perokok."
Tatiana Raysha,5,setahun lalu,Akhir pekan,"wisata terseru, terworth it se jatim ga sieeee!!!✨"
Itcka Wijaya,4,setahun lalu,Hari biasa,"Akses mudah , parkir luas . Satwa lumayan bnyak , terutama berbagai jenis burung. Banyak wahana gratis. Kekurangannya kalau beli di cafe sebelum pintu keluar harus bikin member & top up , serta kolam renang bau amis"
Rizal Aprillian,5,4 tahun lalu,Rizal Aprillian,Harga terbaru selama new normal. Protokol kesehatan juga dilakukan sebelum masuk tempat wisata. Disediakan banyak tempat untuk cuci tangan dan sabun.
delima uyunk,5,2 bulan lalu,Hari biasa,Disini khusus unggas.. banyak wahana edukasinya
yuris chindra,5,2 tahun lalu,Akhir pekan,Cocok untuk anak² dalam masa orientasi pengenalan kepedulian terhadap alam
Ira Sanjaya,5,5 bulan lalu,Hari biasa,seruu banget bisa belajar dan have fun disini
dr Ida Yulianti,4,2 tahun lalu,Hari biasa,"Tempat yg bagus dan edukatif, disini bisa mengenal berbagai macam satwa"
Rathia Aprilia,4,5 tahun lalu,Rathia Aprilia,"Lebih tepatnya bird park...karena kebanyakan isinya burung2, dan ada bird show jg, overall, worth it lah buat harga segitu..."
Febrianto Budimulyono,5,2 tahun lalu,Hari biasa,Cocok buat rekreasi rame2.
Khoyr Nur,5,setahun lalu,Hari biasa,"Puas banget, tempat nyaman Cocok untuk study tour"
Steveyogy,5,setahun lalu,Hari libur nasional,"Tempat Rekreasi, berbagai Hewan Terbaik dan terlengkap ✔️"
rafa fausta,5,2 tahun lalu,Akhir pekan,Koleksi satwa turutama burung sangat bervariasi
OliviaY 313,5,3 tahun lalu,Akhir pekan,"Keren, semua ada, lengkap. Cool abis"
Q. Nuril Q.,5,setahun lalu,Hari biasa,"Sudah 3x ke tempat ini, tetap tidak bosan naik bumper car. Karena luasnya lahan, merasakan lelah juga. Tapi petugas di setiap wahana ramah meski capek antrian panjang."
Obito Prast,5,setahun lalu,Akhir pekan,"Seru, cocok untuk exukasi anak2 usia dini Banyak varian hewan2, dan outbond untuk anak2"
Aris Setiyo Pribadi,4,3 tahun lalu,Hari biasa,Tempat wisata yang menggabungkan konsep edukasi dan refreshing
Rio,5,2 tahun lalu,Hari libur nasional,cocok untuk mengedukasi anak2 dengan hewan-hewan yg menarik dan tidak buas
Andryan Noegroho,5,setahun lalu,Akhir pekan,tempat wisata yg bagus untuk anak2
rizky putranto,5,setahun lalu,Hari biasa,Anak mendapat pengalaman ngasi makan hewan secara langsung.
dewi ida setyawati,5,setahun lalu,Akhir pekan,
Lina Siwu,4,10 bulan lalu,Akhir pekan,Cool place.. bagus banget
Tamara Sandra Devi,5,2 tahun lalu,Hari biasa,"Luas bgt, hewannya sehat2.. good job, lanjutkan"
Tsabiq Riyu,1,setahun lalu,Hari biasa,"Sumpah nyesel banget kalian kesini bayar mahal wahana cuma 2 bioskop kek apalah itu aneh bgt Gaada kolam renang dewasa ,gw saranin mending ke selecta ini wisata tersampah"
Betawi Rantau,4,setahun lalu,Hari biasa,"Ikut antar anak perpisahan di sini, untuk wahana yang ada masih kurang banyak , kolam renang nya juga kurang besar , hewan cuma ada jenis2 burung,"
sututu ss,5,setahun lalu,Akhir pekan,"Tempat yg menyenangkan utk liburan bersama keluarga khususnya anak2 utk belajar aneka satwa yg ada, overall it's ok 🙏"
winda ikke,5,setahun lalu,Hari biasa,"wisata yg cocok untuk balita dan anak, meskipun trnyata isinya 80% hanya burung"", tp untung anaknya happy"" aja"
Doni Indra,5,2 tahun lalu,Hari libur nasional,Buat edukasi ank² worrh it bangeettttzzzz
y. iw4n “Ysy19.72” s,5,3 tahun lalu,Hari libur nasional,Tempat yg nyaman dan penuh edukasi buat anak dalam mengenal binatang dan alam..
Saimoon,5,2 tahun lalu,Hari biasa,"Eco green park di jatim park 2 batu, wisata keluarga yang sangat cocok untuk anak anak mengenal satwa."
Niswa Rais,4,setahun lalu,Akhir pekan,"Salah satu pilihan tempat wisata yang seruuuuu bgt. Tempatnya luas, banyak binatang2nya, wahana mainan juga gratis, makanan2 di food court juga surpisingly enak. Tapi kurang puas sama wahana terakhir yang kereta lewatin 7 keadaan, sama nonton di dome, domenya banyak lubang, kipas angin di depan seat ngeganggu bgt, dan gambar kurang jelas juga kurang menarik 🥲"
elvina dian,5,2 tahun lalu,Akhir pekan,
awan nugroho,5,setahun lalu,Hari libur nasional,"Baik, saya akan mencoba membuat review singkat tentang wisata Ecogreen Park Jatim Park 2. Ini dia review saya: Ecogreen Park Jatim Park 2 adalah tempat yang cocok untuk Anda yang ingin belajar dan peduli terhadap lingkungan. Di sini, Anda bisa melihat berbagai macam tanaman, hewan, dan barang-barang daur ulang yang menarik dan kreatif. Baik, saya akan mencoba membuat review singkat tentang wisata Ecogreen Park Jatim Park 2. Ini dia review saya: Ecogreen Park Jatim Park 2 adalah tempat yang cocok untuk Anda yang ingin belajar dan peduli terhadap lingkungan. Di sini, Anda bisa melihat berbagai macam tanaman, hewan, dan barang-barang daur ulang yang menarik dan kreatif. Anda juga bisa berpartisipasi dalam berbagai kegiatan edukatif, seperti menanam pohon, membuat kompos, dan mengenal energi terbarukan12. Tiket masuk ke Ecogreen Park Jatim Park 2 berkisar antara Rp 50.000-Rp 65.000, tergantung hari dan paket yang Anda pilih23. Jam buka Ecogreen Park adalah dari pukul 08.30 WIB hingga 16.30 WIB24. Anda bisa mengunjungi situs resmi Jatim Park 23 untuk informasi lebih lanjut. Saya merekomendasikan Ecogreen Park Jatim Park 2 sebagai salah satu destinasi wisata yang wajib dikunjungi di Kota Batu. Anda bisa bersenang-senang sekaligus belajar banyak hal tentang lingkungan dan alam di sini. Ecogreen Park Jatim Park 2 adalah tempat yang menggabungkan hiburan dan pendidikan dengan cara yang menarik dan kreatif. 👍 untuk informasi lebih lanjut. Saya merekomendasikan Ecogreen Park Jatim Park 2 sebagai salah satu destinasi wisata yang wajib dikunjungi di Kota Batu. Anda bisa bersenang-senang sekaligus belajar banyak hal tentang lingkungan dan alam di sini. Ecogreen Park Jatim Park 2 adalah tempat yang menggabungkan hiburan dan pendidikan dengan cara yang menarik dan kreatif. 👍"
Imam Zuhdi,5,3 tahun lalu,Lainnya,"Cocok lah ngajak keluarga kesini, bisa sekalian ngedukasi anak."
Gus Wid,5,setahun lalu,Akhir p…,Edukasi untuk si kecil berkaitan dengan fauna...
Dokter Darmanelly,5,setahun lalu,Lainnya,Banyak wahana. Mendidik dan fun. Harga terjangkau. Aman. Indah.
Dewi Sasrika,5,setahun lalu,Akhir pekan,"Tempat wisata terkeren yg pernah saya datangi. Bisa melihat saywa langka yg indah. Tempatnya yg bersih dan terawat, jadi nyaman selama berasa disini. Toilet cukup banyak dan terjaga kebersihannya, di spot istirahat ada tempat jajanan yg harganya ramah di kantong. Recommended utk didatangi."
Sasmita W.,4,setahun lalu,Hari libur nasional,"Cocok untuk rekreasi keluarga, buat edukasi anak dan tempatnya ga terlalu panas juga. Cuma harus siap capek bila jalan kaki. NB: beberapa kandang ada yg kosong ga ada binatangnya."
saniscaya kusumabrata,4,setahun lalu,Hari biasa,"Jauh2 mau liat flamingo, ternyata sedang perbaikan. Ga ada pemberitahuan terlebih dahulu, jadi agak kecewa."
Syahril Yogie,5,2 tahun lalu,Akhir pekan,Tempat bersih Banyak pengetahuan juga didalam sana
jangkung saputro,4,setahun lalu,Akhir pekan,"Blom masuk keseluruhan krn tiket terusan secret zoo dan museum satwa. Harusnya tiket terusan jatimpark2 dibuat 2hr lah, biar puas muternya. Sehari ga cukup buat yg bawa bocil."
Sitiyani Kaha,5,setahun lalu,Hari libur nasional,Seru sekali belajar disini dengan buah hati. Puas pas harganya lagi diskon kemerdekaan. Mungkin karena agak sore atau karena mau closing menurut saya lebih terawat Batu Secret Zoo baik secara kebersihan atau hewannya. Terima kasih
Zenal Mutaqin,5,2 tahun lalu,Hari biasa,Jatim Park2 seru nambah ilmu dan teman baru bagus edukasi untuk kita semua
Ita Subandi,5,setahun lalu,Akhir pekan,"Tempatnya luas sampe capek jalan. Kalau bawa baby jangan lupa bawa stroller atau apapun itu, karna kalau dia jalan atau kita gendong, bakal capek sendiri 😂 Bisa interaksi langsung sama hewan, bagus buat edukasi anak ❤️"
AdiHutama Tour,5,setahun lalu,Hari biasa,"Bagian dari theme park terbesar di Jatim. Wahana wisata keluarga, baik untuk edukasi mengenai berbagai satwa, terutama berbagai macam unggas dan fauna dari berbagai daerah di Indonesia dan manca negara Berada satu area dengan Batu Secret Zoo. Area ini adalah Jatim Park 2"
Re Ni,2,2 tahun lalu,Hari biasa,"Agak ga worthed it sih datang hari jumat tyt kena tiket weekend 75k uda gt byk show2 yg ga tampil karna sepi mungkin, bbrp wahana bermain anak juga ada yg ga dijaga jd kl mw naik musti cari2 yg jaga, rumah terbalik juga gelap dan kotor. Berasa byr tiket weekend di hari jumat tp ga dpt maksimal. Ulangin datang lagi sepertinya enggak deh."
Peter Karel,5,2 tahun lalu,Hari libur nasional,"Uang tiket masuk sudah termasuk wahana bermain anak-anak, harga makanan di dalam terjangkau, binatangnya banyak, atmosfer n tata letaknya bagus, lembang zoo yg baru aja kalah menurut sy"
Masudin Wibowo,5,2 tahun lalu,Hari biasa,Wisata edukasi yang bagus dan cocok buat rekreasi
Dina Noval Madurani,5,setahun lalu,Hari biasa,
Zulfa Nurul,5,3 tahun lalu,Hari biasa,"Tempat yng wajib dikunjungi ketika anda berlibur ke malang/baru,lokasinya berada di batu tidak jauh dari malang kota"
Metredz,5,2 tahun lalu,Hari biasa,Eco Green Park Wahana edukasi wisata anak dan keluarga
Gilang Kurniawan,5,setahun lalu,Akhir pekan,"Bagus buat edukasi anak-anak. Ramah lingkungan, puas."
