reviewer_name,rating,date,visit_time,review_text
Tia Andamsari,5,3 tahun lalu,,"Melihat hamparan tanaman Hortensia yang bunganya mekar mlenuk-mlenuk fluffy begini rasanya takjub-takjub bergembira. Harusnya ada banyak bunga-bunga yang lain di taman bunga dan wisata Selecta Batu ini, tapi yang sedang ranum kali ini adalah Hortensia. #Hortensia #hortensiaflower #bungahortensia #selectamalang #selectabatu #flowers🌸"
gilang ramadhan,5,6 tahun lalu,,"Salah satu tempat rekreasi yang eajib dikunjungi di kota batu, menawarkan banyak wahana2, terdapat kolam renang dan memyajikan tanaman tanaman bunga yang sangat cantik. Area nya pun cukup luas sekali, akses nya juga muda di jangkau"
Devi Santi,5,setahun lalu,Hari biasa,Rabu 07 Februari 2024 HTM 50rb/orang + 10rb karcis mobil
Mey Jaya,5,2 tahun lalu,,Selecta makin cantik ya.. Lebih banyak wahana nya dan juga tempatnya sangat luas..namun harus perlu hati hati karena lokasinya yg d bukit jd pastikan pakai alas kaki yg nyaman biar g capek dan juga perhatikan si kecil karena jln nya yg naik turun
isrotul anggun,5,setahun lalu,Hari biasa,"Salah satau tempat wisata legend di Kota Batu. Tempatnya indah, sejuk, hawanya dingin, dan harga tiket terjangkau 🌸🌸"
Her Blanxz,5,2 tahun lalu,,"lama gak main ke selecta, udah banyak perubahan, tanaman cantik2 (tp msh ada tangan pengunjung yg jahil ambil tanaman) prosotan dari atas resto masih dipertahankan...itu maskot selecta wahana permainan yg baru nambah banyak...good 👍🏻👍🏻👍🏻 …"
Alyan .03,5,6 tahun lalu,,
Dwiyana novi,5,7 bulan lalu,Akhir pekan,"Bagus tempatnya, tapi sayangnya kesana pas hujan"
Chandra Andhika,4,6 tahun lalu,,"Taman rekreasi yang murah meriah, hanya saat weekend sangat crowded dan tidak teratur. Sampah berserakan dimana-mana karena saya liat tempat sampah sangat sedikit. Suasana nyaman dan sejuk masih banyak pepohonan. Wahana bermain menyenangkan dan murah. Serta kolam renang dan waterpark yang cocok untuk anak-anak"
Auliya Wirda,5,2 tahun lalu,Hari biasa,
Takdir Ilahi,5,3 tahun lalu,,"Lingkungannya juga bersih, petugasnya juga ramah-ramah, ditambah udara di Batu yg sejuk dan adem, bikin betah lama-lama disini. Recommended untuk wisata keluarga juga."
Fortunita Fortunita,4,3 tahun lalu,,"Banyak banget yang berubah sejak terakhir ke sini. Udah makin banyak wahananya, ada stand khusus snack. Baksonya mantul, murah enak. Kalo makanan di restorannya malah kurang recommended. Rasanya plain. Gak cocok buat lidah pemuja bumbu kayak aku 😅 …"
Erny Savero,5,7 tahun lalu,,Selecta ada di Batu. Sejak jaman dulu terkenal dengan kolam renangnya. Airnya dingin. Sekarang ada 3 kolam renang terdiri dari kolam dewasa yang agak dalam dan 2 kolam anak dengan waterpark.
ErinHt Ningsih,4,6 tahun lalu,,"Tempat wisata waktu kecilku dulu, setiap rekresasi SD pasti arahnya kesini sampek aku udah umur banyak tetep bagus dan mengikuti perkembangan jaman😊 Murah meriah tiket masuk 35.000 bisa masuk dengan bawa makanan Hari raya begini pengunjuk membludak semua penuh tapi tetep asyik asyik aja …"
Desyana Andreas,5,2 tahun lalu,,
Rizki Nurhasan,5,setahun lalu,Hari biasa,"Masuk 40 k lewat online, nanti ada wahana lagi bayar. Tapi sangat worth it menghabiskan waktu disana , Poko nya harga masuk itu ga sebanding sama wahana didalam nya deh . Joss"
anis pnrisby,5,2 tahun lalu,Hari libur nasional,"Terakhir kesini bbrp tahun lalu dan skrg bagus sekali. Tiket masuk 40.000 per orang. Parkir mobil 10.000. Enaknya kalau masuk kesini boleh membawa makanan dan minuman. Cuman sayangnya kurang tempat utk duduk atau tempat lapang utk nggelar tikar bagi yg datang bersama keluarga. Jadi meskipun bawa makan/minum, agak kesulitan dan percuma juga."
Fauzan S,5,5 tahun lalu,,Lengkap dan luas bgt.. kolam renang . Restoran.. taman bunga.. taman bermain .. harga tiket 35K per orang + parkir 5K untuk motor.. kalo weekend rame bgt disini.. padat bgt malah.. dari parkiran.. akan di jemput sm mobil khusus penjemputan.. jadi jangan jalan kaki yaa .. jauh...
Nugroho Pahlevi,5,6 tahun lalu,,Termasuk tempat wisata legendaris di kota Batu.. Fasilitas yang ada cukup lengkap.. Akses jalan untuk kursi roda pun ada.. meski belum ada parkir khususnya.. Adanya bus shuttle sangat membantu pengunjung untuk mencapai area parkir dan pintu masuk..
puput tri cahyono,5,2 bulan lalu,,Tempatnya bersih parkirannya luas...bnyak wahana baru....htm jga terjangkau...
lintang aurelia,5,5 tahun lalu,,"Taman rekreasi selecta adalah salah satu dari sekian bnyak wisata yang ada di Malang, dmna didalamnya bnyak berbgai macam mainan yg co2k untuk ank2 atopun untuk dwasa, jg ada kolam renang dll"
Indri Aprilia,4,3 tahun lalu,Indri Aprilia,"Tempatnya bagus & bersih, terutama toiletnya, bersih sekali 👍 sayangnya pas ke sana ada area taman yang bunganya mulai dipugar karna sudah layu... …"
Putri Ayu,4,2 tahun lalu,,Di dalamnya ada kolam renang dan juga ada sky bike. Tp sayangnya wktu berkunjung lagi terik² nya matahari jadi agaknya males buat renang hehe. Cakep bisa buat berlibur bersama keluarga
S.Budi Utomo,5,5 tahun lalu,,Jajanan masih murah dan wajar (Pertahankan) Udara sejuk Jajanan di Kota Malang hampir semua warung mencantumkan harga jajanan Contohnya Warung Den Bagus Yang ada di Jl.Raya Tlogomas No.44 (Searching aja di Google Maps) Terima Kasih Kota Malang Salam dari Bekasi
Ilay Lyngling,5,3 tahun lalu,,
Azza Latifah,4,3 tahun lalu,,"Bagus dan Menyenangkan, Wahana nya semakin bervariasi. Cuma sayang kamar mandi air panas nya ga panas2 amat, cenderung dingin sama kyk kamar mandi biasa."
Sigit Purnomo,5,setahun lalu,,"Lumayan bagus tempatnya banyak spot"" yg instagramable.lokasinya luas tidak membuat bosan."
Hadi Poerwanto,5,3 tahun lalu,,"udah lama banget gk kesini... sangat bagus... wahana permainan jg cukup banyak, flyingfog, sky bike, sepeda air, kolam renang, rollercoaster, perahu ayun, bianglala dll"
Dewi Annisa Mamaraffiyya,5,6 tahun lalu,,
Muhammad Fauzan Nz,5,6 bulan lalu,Hari libur nasional,Bagus dan sangat ramah bagi keluarga
widyawanti imandriana,5,setahun lalu,Hari libur nasional,"Tempat nya bersih dan menyenangkan, pokoknya legend dari jaman aku kecil dulu sampai punya anak,tetap favorit tingkat kan terus deh, klo bisa harga lbh terjangkau lg buat mainan dan makannya"
Ukhti Novie,4,setahun lalu,,
Theresia Yuliani,5,2 tahun lalu,,Tiket masuk utk high season 40 ribu/org cukup terjangkau Ada beberapa permainan yg bisa dinaikin anak2 ataupun dewasa dan ada waterpark jg ^^
Dini,4,3 tahun lalu,,Tempat rekreasi keluarga. HTM lumayan. Cuma di beberapa spot dekat burung merak besarnya banyak sampah tersembunyi.
Ani Anoy,5,9 bulan lalu,Akhir pekan,
MTC Pekalongan,5,2 tahun lalu,,"Cukup menghibur, Sayang tiket terlalu mahal untuk usia 2,5 tahun,"
wiwit Putri Sukardi,4,6 tahun lalu,,
pendhool pendhiek,5,3 tahun lalu,,"Tempat rekreasi keluarga yang sangat bagus sekali,,dengan pemandangan di sampingnya yg bagus dan pohon-pohon yang besar masih terjaga,, menambah suasana alami. Pokoknya ssiiipp lah👍,, anak-anak ku sangat betah sekali sampai gak mau pulang 🤭. …"
Rikoalmukarrom Tukang slebew,5,4 tahun lalu,,"Rasanya gk pngin pulang Tempat yg sangat bersih, bebas polusi udara Krna untuk merokok saja udh di sediakan tempat khusus Harga sesuai kualitas 👌👌 …"
Selly Mardasika,5,2 tahun lalu,,
Elia Yohan Yosefa,5,setahun lalu,Hari libur nasional,"Akses kesana mudah karena jalan nya luas biaya masuk per orang 55rb, sudah termasuk parkir, di dalam area ada kolam renang, taman, wahana bermain, resto dan penginapan. cocok utk wisata bersama keluarga"
Lia Zahratin Ni'mah,5,5 tahun lalu,,Salah satu tempat wisata yang epik dan cocok banget buat di kunjungi kalau ke malang Ga cuman bunga bunganya yang keren dan unik unik Kalau yang ke malang wajib nih kesini Biar tau asiknya Ditambah ada kereta dengan rel gantung loh guys Jadi kita bisa liat pemandangan nan indah dari atas 😊
Taswir,5,6 bulan lalu,Akhir pekan,"Tambah bagus,banyak pajangan baru pokoknya bikin betah"
AMIRUDDIN FARID MUKHTADI,3,7 tahun lalu,,tiket 30rb/orang parkir mobil 10rb bakso 15rb tp gak enak.. cocok sih buat lburan buat keluarga yg tjuanya berenang
Just Random,4,8 tahun lalu,,
M. Raditya Nur Ramadhan,5,6 bulan lalu,Akhir pekan,"Pengalaman yang mengesankan dengan Pie Susu Dewata Bali sering kali dimulai dari gigitan pertama. Ketika gigimu menyentuh lapisan pie yang renyah, langsung terasa tekstur kulitnya yang tipis namun kokoh. Begitu sampai pada bagian tengahnya, isian susu yang lembut dengan rasa manis yang pas langsung memenuhi mulut, memberikan sensasi nyaman dan memanjakan lidah."
Chandra Priwatita,5,setahun lalu,Hari libur nasional,
Martedy Darmawan,5,6 tahun lalu,,"tempat rekreasi yang legendaris dari jaman dulu. berusaha bertahan ditengahnya pesatnya jaman. terdapat taman bungan yang sangat indah. ada beberapa kolam renang dan juga khusus anak2. tempat yang pas untuk bersantai bersama keluarga. beberapa mainan seperti sepeda air, sepeda udara dan flying fox. tersedia juga foodcourt dan area parkir yang luas"
faiz fiza,4,7 tahun lalu,,Parkir jg sangat mudah klo plg dr lokasi menuju keparkiran ada juga shelter car.
Yulindi Fauriza,5,7 tahun lalu,,"Kolam renang semakin tahun semakin bagus.. Taman nya di rawat lagi, indah sekali .. Kamar mandi bersih .. Orang jualan makanan, agak berkurang sedikit .. Ada wahana bebek2an, roli coster. Ada mushola dket parkir .. Tapi tempat parkirnya kotor jarang di bersihkan.. Tingkat kan lagi yaa .."
Zur Rawdoh,5,5 tahun lalu,,"Destinasi Wisata yang ada sejak jaman Belanda masih bercokol di Indonesia, selain menikmati pemandangan, kita bisa juga sekaligus menikmati Wahana permainan yang ada, skybycicle, berkuda, dan lain lain..., jangan lupa wahana 4D nya ..., dijamin puas...👍👍👍 …"
Yuniar Lidiawati,5,3 tahun lalu,,"Tempat wisata legendaris di Kota Batu, meskipun banyak wahana wahana baru yang menarik di taman rekreasi Selecta, tapi kolam renang beserta seluncurannya tetap di jaga keasliannya, membuat nostalgia yang tak terlupakan."
Dina Fitriah,5,setahun lalu,Akhir pekan,Cukup ramai untuk berakhir pekan disana namun tetap bisa menikmati suasana dan fasilitas yang tersedia.
Nina Kusuma,5,2 tahun lalu,,Walopun tempat wisata yg cukup tua tapi masih terawat dengan sangat baik. Kamar mandi bersih begitupun suasana didalam. Tidak banyak permainan. Udara sejuk Taman bunga yang berwarna warni
Java Cool,5,5 tahun lalu,,"Recommended.... Ada taman bunga yang indah banget.... Ada water park buat anak sampe dewasa, ada pemandangan2 alami dari lumut2 di sekitaran kolam yang sangat indah.... Cocok buat rekreasi keluarga...."
Debby Wadu,5,5 tahun lalu,,Tempat ini benar-benar luar biasa indah. Keindahannya memikat hatiku untuk balik lagi ke taman rekreasi Selecta. Harga tiketnya masih terjangkau. 40/orang. Parkir cuman 5rbu untuk sepada. Banyak tmpat wahananya.
helmy setyaprayogi,5,setahun lalu,Akhir pekan,"Tempatnya luas ada kolam renang. Taman bunga,mainan,kuda,dll."
Apel Malang,5,2 tahun lalu,,"Kesini pas weekend, ramenya kebangetan, tapi bagus untuk wisata keluarga, ada kolam renang, taman bunga, wahana flying fox, sepeda langit, gondola dan banyak foodcourtnya. Tiket masuk 40rb per orang, tp klo mau naik wahana bayar lagi. Parkir mobilnya luas juga.. Rekomend..."
Andi dwi siswanto,5,2 bulan lalu,Akhir pekan,Hawanya sejuk. Pemandangannya bagus.
Listiani Nanik Soenarti,1,6 tahun lalu,,
Rini Panggabean,5,setahun lalu,Hari biasa,"Tempat yg nyaman untuk rekreasi bersama keluarga. Fasilitas lengkap. Toilet, musholah, smoking area. Semakin cantik dr tahun ke tahun."
Halim Faaiz,4,6 tahun lalu,,"Tempat wisata yang sangat indah. Ada wahana bermain, garden, dan waterpark. Jadi jika kamu kesini, kamu bisa memilih untuk bermain di waterpark, wahana bermain ataupun bersantai dengan pemandangan yang penuh dengan bunga. Sangat cocok untuk berwisata bersama keluarga maupun teman-teman."
Shantica Arum Ramadhani,4,5 tahun lalu,,"Wisata keluarga yang terjangkau, kalau weekend atau hari libur parkir penuh dan jauh dari pintu masuk. Tapi tenang aja ada mobil penjemputan ke pintu masuk. Permainan kurang menantang bagi dewasa, tapi cocok untuk anak-anak."
Latisha Shakira Mikaela,5,setahun lalu,Akhir pekan,"Wisata legendaris malang yang sampai sekarang masih terawat dengan baik, jika kesini ingat masa kecil"
Dito Kurniawan,5,4 tahun lalu,,"Tiketnya masuknya 40ribu, seingat saya terakhir kesini masih 25 ribu, semoga dengan naiknya tarif dibarengi dengan naiknya pelayanan ya. Fasilitas kolam untuk anak-anak sudah sangat baik, sudah dilengkapi dengan tempat duduk berbentuk tribun sehingga orang tua bisa duduk sambil mengawasi anak-anaknya ketika bermain di kolam. Untuk kolam dewasa, saya melihat di seluncuran yang besar itu, tepinya berupa kayu ya, semoga seluncurannya dilakukan pengecekan berkala sehingga selalu aman ketika digunakan. Fasilitas musholla, toilet, tempat makan, dan souvenir semua bersih dan rapi. Sukses selalu untuk Selecta."
Fidya Putri,5,3 tahun lalu,,Semakin ke sini semakin bagus tempatnya Tambah asri & didukung kondisi alam yg sejuk..jd nya mantep deh Mungkin bisa ditambah lg wahana² permainannya Biar bisa puas main² sambil lihat keindahan bunga² Harga tiket wahana relatif..antara 15rb - 25rb Klo bisa ada tikey terusan lbh enak yaa.. Kolam renang jg sdh sangat baik..ada kolam dewasa & anak² yg terpisah letaknya Keberadaan tojlet jg sngt memadai
Ila Muizza,4,7 tahun lalu,,"Terakhir ke sini dulu, bertahun2 lalu, lebih dr 10 tahun. Skrg makin bagus. Tiket 30rb saat wiken. Buka dari jam 6. Kolam renang bersih dan luas, ada khusus anak2 dan orang dewasa. Selecta gardennya lumayan lah."
hendro wahyudi,5,setahun lalu,Akhir pekan,Salah satu alternatif wahana wisata keluarga di daerah Batu dg pemandangan yg indah & fasilitas bermain yg sesuai mulai anak² sampai org dewasa dg harga terjangkau
emaniez ema,5,setahun lalu,,Seru tempat nya. Wahananya juga asyik2. Hanya dengan bayar 40rb utk masuk ke sini. Utk per wahana cuma 10rb'an
Rezaa,5,setahun lalu,Akhir pekan,"Selecta sekarang seru dan sekarang banyak wahana nya.. setiap wahana berbayar mulai dari 10rb/orang untuk naik bianglala, 20rb untuk 2 orang naik skybike dan family coaster. 15rb/orang untuk naik kuda. Kolam renang nya pun bersih dan jernih. Cocok buat liburan keluarga."
Eyka Prasodjo,5,2 tahun lalu,Hari libur nasional,"Masih asri dan bersih sama seperti 3 tahun yang lalu , hanya saja tanaman bunga nya banyak yg di ganti dengan tanaman yang baru , seperti Balum lama di tanam"
Kuliyatul As'ari,5,4 bulan lalu,Hari libur nasional,Cocok untuk wisata keluarga
Ulil Abshor,5,2 tahun lalu,,"Cocok untuk rekreasi segala usia. Ada kolam renang, baik anak maupun dewasa. Wahana Sepeda Gantung, Family Roller Coaster dll. Restoran pun ada beberapa. Jd tidak takut kelaparan. Lokasi sangat mudah di jangkau, baik kendaran roda dua maupun roda 4. Di sekitar Selecta, ada banyak penginapan² bagi yg rumahnya jauh."
Ltf,5,setahun lalu,Hari biasa,"Kenangan masa kecil yg cuma ada kolam renang, sekarang sudah tambah bagus dan banyak wahana."
Sutneva W,4,8 tahun lalu,,
Bahtiar Ridwan,5,2 tahun lalu,,puas dan puas dari segala area taman dan tempat bermain ... tdk menyesal jauh dari kota klaten jateng datang kesini ... capek hilang ditebus dgn keindahan pesona alam exotick !
nayla zulfa,5,sebulan lalu,Hari libur nasional,"seru sekali untuk ikan ya bagus bagus apalagi wisata seru ye NEKS TIME , AKU BAKAL KESANA LAGI BULAN DEPAN"
Berthin Anggraeni,5,2 tahun lalu,Hari biasa,"Tempat yg menyenangkan untuk liburan Ada kolam renang, permainan untuk anak2, pemandangan yg bagus cocok untuk selfi2 Pokoknya Recomended banget untuk dikunjungi jika ke malang.."
Unsi Alexandrite,4,6 tahun lalu,,"Tempat rekreasi lama tapi terus diberikan sentuhan biar bisa kekinian. Tiket sekali masuk tanpa harus bayar2 berkali2 kecuali naik wahana. Banyak hal ada disini yang khas adalah Taman bunga yang indah. Ada waterpark, kolam ikan, pasar wisata, aneka photo spot dll. Wahana berbayar ada roller coaster, flying fox, berkuda, sky cycle, dll."
ytsE 3as2ti,5,5 tahun lalu,,"Salah satu tempat rekreasi yang indah, bagus, murah yang menjadi tujuan wisata keluarga dengan fasilitas lengkap, lahan yang luas ditanami aneka bunga, wahana permain. Parkir luas"
Azizatul Mahfida Inayati,4,6 tahun lalu,,
Aris Pratama,5,3 minggu lalu,Hari biasa,jangan cuma 2 jam di sini
Devi Violita,4,5 tahun lalu,,
Siti Aminah,5,setahun lalu,,"Nyaman, bersih ada kolam renang dan permainan untuk anak anak dan dewasa. Taman bunga yang indah"
Rizky Muthoharoh,4,6 tahun lalu,,"Kebun bunganya cantii, dan luas, disini juga ada beberapa wahana permainan berbayar fi luar dri tiket masuk, setiap wahana min 10rb dan max 25rb, ada wahanan sky bike, family coaster, perahu ayun, dan 4d cinema dan mainan anak, tiket masuk sudah termasuk berenang di water park yg tersedia di selecta, selain itu parkiran juga luas dan kita bisa membawa makanan sendiri, tpi disana juga tersedia foodcourt yg juga ckup murah ..."
anggara jaya wardhana,5,7 tahun lalu,,Di Selecta juga menyediakan kegiatan outbound yang di kelola oleh provider profesional.
"Eat, travel and have fun",4,5 tahun lalu,,"Tempatnya seperti Green Apple Puncak. Jadi seperti taman wisata keluarga dengan hamparan taman bunga. Tiket wisata untuk masuk tergolong pricey klo hanya untuk sekedar masuk ke tempat wisata dan tidak dpt apa2. Di dlm ada bbrapa wahsna edukasi wisata yg masing2 wahana harus kita bayar bila ingin mencoba. Rata2 tiket Rp 20 rb. Ada bebek2an, Mini coaster, Bianglala, Naik kuda, dll"
Ega Amalia Elista,4,6 tahun lalu,,"Tempat rekreasi keluarga yang bagus 👏 Bukan hanya tempat rekreasi, tapi tempat belajar untuk anak2 juga. Belajar sambil bermain lah. Dengan harga tiket 35rb/orang (tidak termasuk parkir kendaraan) lumayan murah. Tapi sayang waktu itu kendaraan saya tidak sampai masuk area Selecta, tapi pihak pengelola menyediakan supir dan kendaraan untuk mengantar pengunjung sampai ke area wisata. Overall, ini tempat yang menyenangkan. Ada kolam ikan, kolam renang, wahana bermain, taman bunga, karaoke, cafe dan restoran, tempat ibadah, dan juga toilet umum yang tersebar di berbagai titik area wisata."
dita berlina,5,6 bulan lalu,Hari libur nasional,Sueruuuu rainbow slide nya..puanjang JD teriaknya bs lamaaaa😅🤣🤣
Izza Zhafirah,5,setahun lalu,Hari biasa,gorgeous place ..full of flowers and some plants... wort it for kids aneka ragam permainan yg ramah anak
Glenn Noya,5,2 tahun lalu,,"Setelah puluhan tahun baru bisa kembali lagi.....Bagus dan bersih sekali, walaupun salah satu rekreasi heritage"
Noor,5,3 tahun lalu,,"Tempatnya bagus bersih..Ikan2 koinya bikin jatuh cinta deh... pelayanan baik... karyawan ramah2... makanannya tidak begitu mahal untuk ukuran tempat wisata,kita juga bisa beli bunga2 yang indah dengan harga yang ramah di kantor souvernir juga banyak tersedia...tempat parkir luas..kalau ke Malang mampir kesini saja recommended banget lho....."
Nuzulia MJ,5,5 tahun lalu,,"Tempatnya menyenangkan. Banyak wahana seperti bianglala, roller coaster, water park untuk anak2 dan dewasa, kolam renang, menunggang kuda, 4D cinema, restoran, dll. Taman bunganya indaaaah"
Ida Arodah,4,setahun lalu,Hari libur nasional,"Bagus sekarang banyak permainannya, dulu kesini masih sedikit tapi hamparan bunganya bagus bagus, sekarang bunganya kurang menggoda. Oh ya Kalau mau duduk duduk di atas harus bawa sofel ya😁 banyak nyamuk. terutama yg bawa pohon pohon"
M. Nashiruddin Natsir,5,5 tahun lalu,,
Adjie Booxien,5,2 tahun lalu,Akhir pekan,"Selecta sudah berbenah, banyak perubahan setelah 10 tahun yg lalu terakhir kesini. Dan juga tolong diberi spot khusus perokok, aga udara asrinya tidak tercemar asap rokok."
Opi Pyo,5,5 tahun lalu,,
Helen Delia Putri,5,7 tahun lalu,,
yuly ratna pratiwi,5,setahun lalu,Hari libur nasional,"Wahana nya udh macem2 bgd, utk harga tiket masuk 40rb/org (anak s.d 2 thn msh free) dan tiket parkir 10rb (flat) sangat worth it."
keke syia,5,7 tahun lalu,,
Sugeng Basuki,5,7 tahun lalu,,"Untuk sebuah taman, tempat ini sudah oke. Tanaman warna warni ditata dgn baik. Ada wahana bermain. Kolam renang juga ada. Udaranya mantab bbbrrrrrr adem :) Oya, untuk yg bawa motor ada shuttle'nya. Untuk parkiran mobil luas walo ada yang agak jauh."
Puput Anggara,5,6 tahun lalu,,"Tempatnya asyik banget.. Adem hawanya.. Buat kalian yang lagi tempat liburan taman bunga selecta recommended banget nihh.. Di selecta ada apa aja sihh..?? Disana itu yg terkenal taman bunganya.. Tapi tenang disana juga ada wahana bermainnya sprti sky bike, roller coster mini, kolam renang anak n dewasa, dan juga ada wisata berkuda... Dijamin bikin liburan kalian sekeluarga jadi happy... 😉😉😉"
Eka Nurisma I,4,5 tahun lalu,,
tessy dian apsari,3,5 tahun lalu,,"Tempat rekreasi di batu, terutama anak-anak, ada kolam renangnya, taman bunga, sky bike, flying fox, aquarium berbagai macam dan jenis ikan, tiketnya terjangkau, bisa bawa makanan dan minuman ke dalam, jadi bisa menggelar tikar bersama keluarga dan makan bersama"
Embun Res,4,2 tahun lalu,,"Minus: sayangnya, wahana permainan nya berbayar🤭 …"
Rufita Trihana Lestari,5,4 tahun lalu,,"Tempatnya sejuk dan luas ..ada kebun bunga ,kolam renang ,hotel ,kafe dan pasar ..cocok untuk liburan bersama keluarga dan teman."
Kusuma YF,5,5 tahun lalu,,
Nurul Eliyanti,5,6 tahun lalu,,
RUSFEMINA,5,5 tahun lalu,,Indahnya bunga Taman reaksi Ikan big size Looks spot Instagram lover Waterboom wow Mainan sky bike yg ok Mainan Laen ok D parkir aneka tumbuhan bibit dan yg ok ada Aneka buah bakso dll ok
gra listello,5,2 tahun lalu,"tahun baru 1 januari 2023 ,,","tahun baru 1 januari 2023 ,, tempat penuh,, ada live music kolam renang penuh, service utk pengunjung memuaskan,, bagus krn ada angkutan antar jemput gratis... TOP lah,,,👌👍👍"
מחילה,5,2 tahun lalu,,"Bikin seger mata, hati dan jiwa 😍 liat bunga2 yang begitu banyak, wahana permainan, sekaligus wahana isi perut. Tiket masuk 40k/orang. Untuk wahana permainan masih harus beli tiket ya guys, ndak mahal kok masih di kisaran 10k-20k/orang …"
Ajie_ jm,4,setahun lalu,Hari libur nasional,Cocok buat weekend keluarga.. berangkat pagi-pagi biar gak macet dan dapat tempat parkir
UmiNya Hilza,5,2 tahun lalu,,"Disini bisa berenang, main air sepuasnya ada juga wahana sky bike. Ada penyewaan ban tentu. Parkir luas banget. Htm kira2 30 ribu perorang. Gatau pasti sih, dibayarin soalnya. Wkwkwk Yang pasti puasss disini"
Ersyap,4,7 tahun lalu,,"Akses nyaman..Udara yang segar, taman bunga bagus , water park, kolam renang bersih.. permainan tambahan flying f, sky bike, roller coaster ticket hanya 20.000... sangat memuaskan.. Saran: kalau bisa sky bike arah lintasan di balik, sehingga kalau pengunjung mau diambil gambar, terkahir saat mendekat pemberhentian bisa menghadap ke photografer..view nya akan sangat bagus.. ke arah lembah.. mantap."
Alim Winata,5,5 bulan lalu,,"Sejuk alami, Mountain View,,, mandi belerang,,, maen gym,,, Old Friend at Imannuel School,PGRI,Yos Sudarso,,, Sengkaling nanjak Kampus Amien R. Terusan Tidar nongkrong di Blimbing nyari ayam UWM"
farid usman,4,6 tahun lalu,,Tempat wisata di malang yang paling legend Areanya sangat luas dan udaranya sangat sejuk karena selekta berada di daerah batu malang yang sudah terkenal udaranya sejuk. Disamping ada kolam renang dan taman bunga di selekta juga ada beberapa wahana yang bisa dinikmati seluruh anggota keluarga dan harganyapun terbilang tidak mahal. Jangan lupa kalo ke selekta cari musim yang selain musim hujan
Putri Desita,5,5 tahun lalu,,
anis sulalatin,5,3 tahun lalu,,"Assalamualaikum wrwb Alhamdulillah, Maturnuwun Pak Teguh, atas izin dan rekomendasi dari Pak Teguh, kami kelas 8A, berwisata ke Selekta Batu, dg menggunakan Bis POLRESTA MALANG. Semoga kebaikan Pak Teguh dibalas oleh Alloh SWT. dengan rezeki dan pahala yg melimpah. Barokalloh utk kita semua... Aamiin Allohumma aamiin🤲🤲🤲🤲"
Sudar sono,5,6 tahun lalu,,Panorama taman bunga yg menawan apalagi dengan cuaca dingin yg identik dg kota malang. Sangat nyaman berlama2 hanya untuk sekedar selfie..
Satu Warna,4,setahun lalu,Akhir pekan,"Karena dari segi lahan tidak terlalu besar jadi saat pengunjung membludak jadi sangat tidak kondusif sih, padet banget dari parkir sampe masuk lokasi pun sama padetnya."
dieto33,5,setahun lalu,Akhir pekan,"Suasana dan tempatnya makin nyaman dan bagus sekarang, cocok buat sarana rekreasi keluarga."
fika rizkyanti,4,3 tahun lalu,,
FNA Programs,5,6 tahun lalu,,Selecta atau biasa disebut Selekta merupakan salah satu tempat rekreasi di Kota Batu yang cantik. Lokasi Selecta berada di ketinggian 1150 m dari permukaan laut. namun hal tersebut tidak membuatnya sulit untuk dijangkau. Untuk mencapai Selecta kita perlu menempuh jarak sejauh 8 km ke arah utara dari pusat pemerintahan kota Batu bisa menggunakan fasilitas angkutan umum bahkan ojek online yang saat ini mulai menjamurrr
Nia aqila,4,4 tahun lalu,,Bagus..flowers gardennya indah..cocok untuk jalan jalan bareng keluarga.klo mau renang sdh nggk bayar lagi
Muhammad Afdholi,4,3 tahun lalu,,"tertata rapi dan bersih tamannya, toilet juga diperhatikan banget, water park dirawat, tidak kelihatan bekas pendemi.. yg buat saya terheran2 pengunjung tidak dilarang membawa makanan dari luar dan gelar tikar di depan persis restaurant untuk makan bersama keluarga. jarang tempat wisata yg ijinkan bawa makanan begini hanya di Selecta mngkn. tapi ada yg menurut saya menggangu pandangan, life guard water park merokok saat bekerja, jadi bintang 4 saja dulu.."
Rina Tria,5,2 tahun lalu,,
