reviewer_name,rating,date,visit_time,review_text
Fian Yulio Santoso,5,6 tahun lalu,,untuk parkiran sangat luas sehingga tidak perlu khawatir ketika musim liburan ketika banyak pengunjung Tiket masuk cukup terjangkau 35rb per orang dan 10 rb untuk parkir mobil
Fenty Raf,5,setahun lalu,Akhir pekan,
Jeffry Risandy,5,2 tahun lalu,,"Selecta Garden memang sudah dikenal dengan wisata bunganya. Wisata ini kepemilikan sahamnya dimiliki oleh masyarakat Kota Batu khususnya di Desa Tulungrejo, Kecamatan Bumiaji. Nama Taman Selecta Malang ini diambil dari bahasa Belanda. Kata bahasa Belanda “Selectie” yang artinya pilihan. Objek wisata ini dibangun selama kurang lebih 8 tahun. Kurun waktu pembangunan antara tahun 1920 hingga tahun 1928. Dulunya objek wisata ini tidak dibuka untuk umum, dan hanya diperuntukkan khusus bagi peristirahatan orang-orang Belanda. Namun setelah direnovasi atau dikembangkan lagi tahun 1950, wisata ini dibuka untuk masyarakat umum hingga sekarang. Objek wisata Malang ini benar-benar menyuguhkan konsep taman yang berbeda. Taman Selecta Malang memiliki luas keseluruhan sekitar 18 hektar. Namun yang digunakan sebagai taman bunga atau kebun bunga hanya sekitar 10 hektar. Pemandangan taman yang ada, dikonsep dengan petak-petak berbentuk persegi. Susunannya pun sangat rapi dan teratur. Tiap persegi dengan ukuran yang berbeda-beda pun diberi tanaman bunga yang berbeda. Bunga-bunganya pun bermekaran sesuai dengan musim mekarnya masing-masing. Untuk menyusuri area ini wisatawan dapat melewati jalanan yang dibangun di antara taman bunga yang indah. Kurang lebih akan ditemui setidaknya puluhan spesies bunga dengan berbagai jenis dan warna. Jenis yang dominan di sini adalah bunga kana, krisan, ajisai, dan berbagai jenis bunga dari daerah-daerah di Indonesia. Meski dimanjakan dengan berbagai bunga yang indah, namun di sini wisatawan dilarang keras untuk memetik atau membawa pulang bunga. Selain itu, berbagai wahana pun dikembangkan di objek wisata ini untuk mendukung fasilitas yang ada. Wahana yang menarik diantaranya: Skybike, Perahu Ayun, Flying Fox, Bioskop 4D, berkuda dan juga ada pula Play Ground untuk anak-anak. Bermain dan menyegarkan pikiran dengan bunga-bunga, objek wisata ini sangat cocok digunakan untuk belajar dan mencari pengalaman wisata yang baru. Jika ingin berwisata di Taman Rekreasi Selecta, kamu perlu mengetahui harga tiket masuknya. Harga tiket masuk Taman Rekreasi Selecta adalah Rp 40.000 per orang. Tidak ada perbedaan harga tiket masuk saat hari kerja (weekdays) maupun akhir pekan (weekend). Selamat ber-refreshing ria ya dulur! Salam hangat @jeffryrisandy"
Sescy Dian Wijayanti,5,setahun lalu,Hari libur nasional,"Salah satu destinasi wisata menarik di Batu. Alam yang indah, fasilitas banyak dan bersih. Kebun bunganya sangat instagramable. Wahana utk bermain juga banyak. Recommended buat wisata keluarga"
elya Wulanjari,5,2 tahun lalu,,"Salah satu tempat wisata di Batu Malang yang sangat luas.. Sangat kids friendly.. Fasilitas cukup lengkap, mulai dari gift shop, kolam renang, komidi putar, taman bunga, food court, mushola, dan lain sebagainya.. Toilet bersih, parkiran luas.. Jika berwisata kemari jangan lupa sempatkan untuk membeli oleh2 di kios yang berada di dekat parkiran.. Harganya cukup murah, sekilo apel berada di kisaran 25K, untuk keripik buah ada yang 15K isi 5.. Ada pula tanaman dan bunga2 cantik yang dijual dengan harga yg cukup terjangkau.."
Iin Suwarning,5,3 tahun lalu,,Selecta yang sekarang seru buat liburan bareng keluarga . Kolam renangnya bersih tapi memang tidak ada waterboomnya. Ada beberapa kolam dengan pilihan kedalaman . Penataan tamannya yang selalu menyejukkan mata. Ada juga tambahan Wahana wahana lain yang dibayar diluar biaya karcis masuk . Misal sky bike 20 k untuk 2 orang . Sky bike nya seru karena dibawahnya tepat ada tamannya yg indah
Ellys Roro,5,5 tahun lalu,,"Tempat rekreasi Selecta adalah salah satu tempat rekreasi dan pemandian yang sejak sy kecil SDH ada dengan pemandangan pegunungan yang asri dan asli, tempat nya luas dan sarana permainan untuk anak jg lengkap, parkiran luas dan cocok untuk rombongan, pemandangan dan bunga bunga yang sangat indah dan sejuk dipandang mata"
Putri Agil,5,2 tahun lalu,Hari libur nasional,"Murah fasilitas Oke, dianter sampek parkiran jadi gak capek pas ke mobil xixi untuk tiket wahana termasuk murah mulai serba 10rb an aja tetep pertahankan pelayanan dan harga ya kak"
My Fahmil Ma'ruf,5,5 tahun lalu,,"Hallo sahabat travelers, Hari saya akan mereview tentang taman wisata selecta, Tempat wisata keluarga yg nyaman, aman, dan menyenangkan. Parkiran luas, mushola dan toilet bersih, ada roller coaster, kolam renang, flayingfox dll. Yang pasti di selecta tanaman bunga yg menyejukkan..."
Heppy Wardhani,5,6 tahun lalu,,Banyak wahana permainan yg berbayar.
Sarie Avriel,4,3 tahun lalu,,"HTM 40rb , tpi spertinya anak2 tidak ditarik tiket masuk, krna sya bwa anak umur 5thun tidak pke tiket, tiap wahana bayar lagi ya.. ada sepeda udara 20k, naik kuda 15k, perahu air 10k, dll. Bnyak spot selfi. Harga makanan wajar untuk tempat wisata , rata2 30k. Saya ksana hari minggu fullll banget orangnya. Untuk overall rating 4 dari 5."
RIRIS RUKHMANA,5,6 tahun lalu,,Aaahhhh lama gak kesini. Ehh kesininya udah ada bbrpa wahana... mau berenang kayak iya kayak enggak. Airnya dingin banget... tp asik bngt tmptnya. Enak buat piknik bareng keluarga sambil menikmati pemandangan bunga2 yg mekar. Adem ayem berada dsini.. 😍😍😍😍😍😍😍😍😍❤❤❤ …
Noraot,5,3 tahun lalu,,Susananya ramai saat sy brkunjung. Pelayanan dsni ramah².. bhkn bpk² parkir pun ramah².. diswdiakan kndaraan gratis dr selecta utk yg parkir mkbilnya jauh dr lokasi msuk.
Ferinaldy,5,5 tahun lalu,,"Objek wisata Malang ini benar-benar menyuguhkan konsep taman yang berbeda. Taman Selecta Malang memiliki luas keseluruhan sekitar 18 hektar. Namun yang digunakan sebagai taman bunga atau kebun bunga hanya sekitar 10 hektar. Selain itu, berbagai wahana pun dikembangkan di objek wisata ini untuk mendukung fasilitas yang ada. Wahana yang menarik diantaranya: Skybike, Perahu Ayun, Flying Fox, Bioskop 4D, berkuda dan juga ada pula Play Ground untuk anak-anak. Bermain dan menyegarkan pikiran dengan bunga-bunga, objek wisata ini sangat cocok digunakan untuk belajar dan mencari pengalaman wisata yang baru. Taman Selecta Malang dibuka setiap hari dari pagi hingga sore hari. Pengunjung bisa datang mulai pukul 6 pagi. Tiket Reguler Setiap Hari - Rp40.000"
Ellyata Setiawan,5,5 tahun lalu,,"Tempat rekreasi wisata kebun bunga tertua di Indonesia yang tidak hanya menyuguhkan wisata alam yang indah namun juga dilengkapi wahana permainan bagi anak-anak. Lokasi wisata yang berada dekat dengan pegunungan membuat udara disini terasa dingin dan sejuk. Dengan tiket masuk seharga 40.000 per orang dan harga parkir mobil seharga 10.000, kalian sudah bisa menghabiskan waktu rekreasi bersama dengan keluarga. Berikut ini wahana permainan disini yaitu sky bike, water park, perahu ayun, menunggang kuda, goa singa, taman bunga, bioskop 4D, sepeda air, flying fox, family coaster, dan biang lala. Bila liburan tiba, tempat wisata ini padat didatangi pengunjung. Ada foodcourt yang menjual makanan dan minumannya juga."
Ima Virgianti,5,4 tahun lalu,,"Tempat rekreasi daerah batu malang, kalo dari surabaya lewat tol deket banget. Disini sekarang ngga hanya taman bunga ataupun kolam renang, skg ada beberapa wahana juga, bagus view nya tapi kalo weekend dan hari libur ruame poll, oh ya sebelahnya selecta juga ada pasar. Pasar ini menjual berbagai jenis tanaman dan juga menjual buah dan sayuran. Tiket masuk nya waktu itu sekitar 25-35 rb/orang"
FAV AChonk,5,6 tahun lalu,,"Cuaca terik, tapi angin semriwingnya dingin. Kayak es teh anget. Tapi suasana yang beginilah yang bikin kangen. Pilihan permainan yang variatif, kolam reng yang luas, pemandangan kebun bunga yangvterhampar luas semakin memanjakan mata dan jiwa. Terasa nyaman dan meneduhkan hati gersang yang terbiasa dengan rutinitas perkotaan didaerah pesisir pantai tropis yang lumayan panas."
Mas Agung Aji Priya Nanda,3,6 tahun lalu,,"Jika berkunjung kemari menggunakan moda transportasi sepeda motor, dari parkiran depan menuju ke pintu masuk bisa menggunakan shuttle bus yang disediakan oleh pengelola. Biaya shuttle bus sudah termasuk dalam tiket. Untuk rute di dalam tempat rekreasi, apalagi paling belakang, mungkin harus hati-hati saat melewati. Apalagi tangga yang tidak mempunyai pegangan tangan. Sepertinya butuh perhatian khusus lagi dari pengelola. Untuk pengunjung, sebaiknya sebelum kemari, persiapkan stamina yang cukup, dikarenakan jalur dalam tempat wisata yang mengikuti kontur pegunungan. Lebih baik menanyakan terlebih dahulu kepada petugas tentang ketersediaan/penyewaan kursi roda. Untuk pasar wisata dan oleh-oleh berupa apel Malang, aneka keripik, buah-buahan, sayuran, letaknya di ujung pintu keluar parkiran bus. Satu lagi, jika menggunakan moda transportasi taksi/ojek berbasis aplikasi untuk pulang, sebaiknya menunggu di depan lobby Hotel Selecta dan memilih opsi pembayaran tunai daripada pembayaran dompet online, agar mudah mendapat driver."
I GEDE DIARSANA,4,setahun lalu,Akhir pekan,"Wisata alam dekat kota batu dengan kebun bunga warna warni dan wahana permainan, cocok buat refreshing bersama keluarga"
Maria Andreana,5,5 tahun lalu,,
Isrotul Aisyah,5,setahun lalu,Akhir pekan,"Tempat wisata yang sangat asri, banyak jenis-jenis tanaman bunga, beberapa wahana permainan dan kolam renang dengan kedalaman yang bervariasi lengkap dengan wahana air/perosotannya. Cocok sebagai tempat rekreasi keluarga."
The Wan One,5,7 bulan lalu,Hari biasa,Klo Liburan ke Batu/Malang kami selalu menyempatkan diri main ke Selecta... Salah satu destinasi wisata dengan suasana alami yang akan menyejukkan mata & pikiran.. Setelah renovasi sekarang tampak lebih bersih dan terawat.
Gracia Luciana,5,7 tahun lalu,,
Nabila Khaira,4,6 tahun lalu,,"Disarankan datang pagi, sekitar jam 8-9 karena masih sepi, bisa berenang dengan santai karena kolam masih kosong. Penjaga kolamnya sigap, Air kolamnya dingin parah, saya cuma renang cuma sekali keliling lalu selesai, mandi dengan air hangat bayar 5k per orang. Dari jam 10 sudah mulai ramai. Selecta memang cocok untuk kegiatan kelurga, rt, rw, kegiatan bersama-sama. Ada outbond, ada restaurant, live music mulai jam 12 siang, ada permainan panah, sepeda udara, naik kuda, naik bebek sepeda air spot selfie dengan bunga berearna warni."
rumahmimi57,5,setahun lalu,Hari biasa,"Menyejukkan mata. Walau sayang pas kesini, sky bike sama family coasternya sedang maintenance. HTM 40/orang"
Wiwin Oktavianti,4,3 tahun lalu,,"Boleh bawa makanan dari luar, ada kolam renang, tiket relatif murah (30rban perorang) dan tempatnya luas. Cocoklah buat piknik santai bareng keluarga. Sayangnya tempat parkir motor yang sekarang jauh dari pintu masuk."
amalina izazi,5,setahun lalu,,"Tempat wisata sangat pas buat keluarga, terutama anak-anak Kolam renang anak & dewasa Wahana bermain: flying fox, sky bike, traimp, roller coaster, biang lala, dino ride"
Indra Wahyudi,5,3 tahun lalu,,Selecta garden tempatnya sangat luas parkiran banyak toilet juga banyak 👍 Lokasinya sangat nyaman boleh membawa makanan sendiri disarankan membawa tikar untuk istirahat di dalam
Aris Lukman Hakim,5,3 bulan lalu,,Tempat rekreasi keluarga yg menyenangkan.
Adri Imran (sihungisme),5,7 tahun lalu,,
Yanti Mei (Yanti),4,6 tahun lalu,Yanti Mei (Yanti),Selecta ini bagus banget loh.. Jujur nih udah sering maen ke Batu Malang tapi baru kali ini sempet mampir ke selecta. Ternyata bagus banget.. Tiket murah loh hanya 35 rb aja. Naik wahana juga bayar gak mahal. Misal naik kuda cuma 15 rb aja.. Banyak wahana juga di sana. Mau renang udah gratis.. Mau mandi pake air hangat cuma bayar 5rb aja.. Toilet bersih banget. Pokoknya nyaman..
Irma Lantika,4,6 tahun lalu,,"Tiket masuk murah 35rb per orang, untuk.wahana didalam bayar lagi rata2 15-25rb..taman rapi tapi kurang luas taman bunganya karena kayanya kebanyakan kolam n tempat makan.. Bunganya terawat tapi kurang banyak varian, akses untuk stroller dan kursi roda juga ada hanya saja tracknya curam alias naik turun banget.Banyak apot.selfie yang instagramable. Tempat untuk duduk santai agak kurang di area taman, kebanyakan di area resto n foodcourt saja."
Sita Szylensky,5,3 tahun lalu,,"Syuuukkàaaaakk bànget.... Dari kecil sampe punya anak kecil, selalu berkunjung ke Selecta. Selalu puas dan menyenangkan berkunjung ke sini. Dan sekarang banyak wahana seperti bianglala, sepeda air, dll yang bikin anak-anak tambah betah disini."
Nicholas Christian,5,2 bulan lalu,Hari biasa,"Seru, menyenangkan dan tidak bosan² kami disana"
Aryabhima A. Rahman,5,3 tahun lalu,,"kolam renangnya ada 3: untuk anak2, untuk belajar berenang dan untuk yang sudah jago berenang. Airnya sangat dingin tapi untuk bilas ada fasilitas air hangat dengan biaya 5000 IDR. wahananya banyak dan tidak mahal. taman bunganya bagus dan luas, terutama taman bunga hydrangea / ajisainya."
Victoria Adeline Ayu,5,2 tahun lalu,Akhir pekan,banyak pengunjung mayoritas anak2 berenang
visa comel,4,2 tahun lalu,Akhir pekan,"Ada tiket masuk, dan untuk naik wahana ya bayar lagi. Paling mahal sekitar 30 ribuan 1 wahana Tapi nih ya kalau rame, kadang kendaraan mau masuk ya harus nunggu lumayan. Karena ya emang tempat rekreasi kan, banyak bus juga Di dalemnya kayak gimana, secara garis besar yaa taman"
wahyu sutrisno,5,seminggu lalu,,Tempat rekreasi alam yg paling lama ada di kota batu serta sangat indah pemandangan nya
Keyla,5,2 tahun lalu,Hari biasa,"Bagus banget, bener² healing. Aku kesini sama keluarga. Kalo ngeluaring budget mungkin 200-250 an per orang, tspi still recomenddation sih. Apalagi nsik flying fox sama sky bike 🤍"
ongge nur,5,3 minggu lalu,Akhir pekan,Baguss tempatnya.... Dinginin sekalii..
Vicktor SK,5,4 tahun lalu,,"lokasinya enak, dingin, penuh dengan bunga bunga, yg asik bisa sekalian berenang karena ada waterparknya. jangan lupa bawa jaket kesini karena sering angin kencang dan tentu saja dingiinnn... oiya htmnya juga terjangkau sekali"
DEV Elvita,5,5 tahun lalu,,"Kesini weekend dan hasilnya rame poll 🤣 Tiket masuk nya murah meriah,harga weekend dan weekdays sama untungnya Tamannya terawat dan bagus,cocok untuk berbagai usia. Cocok buat rekreasi keluarga Disini menawarkan pemandangan alam yang hijau dan warna bunga bunga yang cantik. Sangat membantu sekali yang pengen menghilangkan kejenuhan tapi kalau datang jangan pas weekend sih soalnya pasti rame sumpek Ada berbagai wahana juga,seperti sky bike,kuda,flying fox,roller coaser. Toilet bersih dan banyak jadi enggak perlu ngantri cuman kebersihan seperti bau-baunya masih kecium"
Yaffa Theophilia,5,setahun lalu,Hari biasa,"kesini pas perpisahan smp. tmptnya bagus sih, luas juga, ada taman bunga gtu cakep bgtt, ada wahana juga, trs ada kolam renang jg 😁"
Fena Agesrin,3,setahun lalu,,"Tempatnya bersih ,kamar mandi bersih , Ada kolam renang dan wahana lainya Seperti buang lala,kora2. Pas kesini pas cuti hari natal sangat2 ramai sekali"
Devi Kartika,4,setahun lalu,Akhir pekan,"Tempat Rekreasi yg paling lama ada d Batu dan masih Hits sampai sekarang 🤩 dengan harga tiket masuk 50k per orang, sudah bisa menikmati kolam renang dan taman bunga yang indah. Untuk permainan yg lain bisa langsung beli tiket di dekat area permainan tersebut."
Wafda Nuha,5,setahun lalu,Akhir pekan,"Harga tiket weekend: 50.000 per orang. Weekend lumayan ramai tapi tidak terlalu padat. Masih bisa berkeliling dan berjalan-jalan dengan nyaman. Ada beberapa wahana yg bisa dicoba. Tiket kuda: 15.000 (sekali naik kurang lebih 100m). Tiket bianglala: 10.000 (sekali naik satu putaran). Kurang lebih tempat yg menyenangkan utk keluarga. Bisa membawa makanan sendiri, dan ada beberapa pilihan restoran disana. Naik taksi online juga lancar, bisa diantar & dijemput sampai lobby utama. Jaga-jaga bawa cash utk transaksi."
Arsyil ya,5,3 tahun lalu,,"Taman bermain yang luas dan bersih,bisa menampung ribuan pengunjung,parkir luas,berbagai macam wahana permainan.sangat cocok untuk berlibur bersama keluarga.tidak mengecewakan dah pokoknya."
Mardiyatul Maula,5,4 tahun lalu,,
Ratnany Indraswari,5,4 tahun lalu,,
Ahmad hikam Al kahfi,4,5 tahun lalu,,"Tiba di tempat ini, Anda dapat melihat aquarium besar dengan berbagai ikan yang ada di dalamnya sebagai hal pertama yang akan dinikmati sebelum hal-hal menarik lain yang akan ditemui di dalam tempat wisata ini. Memasuki tempat rekreasi Selecta, Anda akan disuguhi panorama indah yang alami. Tempat rekreasi ini dibuat menyerupai taman dengan bunga-bunga yang berwarna-warni yang sangat menarik mata. Bunga-bunga yang hidup terlihat segar dan lebih merekah daripada yang mungkin biasa Anda lihat di daerah perkotaan, mungkin karena udara yang mendukung perkembangan bunga-bunga ini."
Nova Putri Diana,5,setahun lalu,,wkwkwk seru banget. HTM 50k. wahana yg gretong hanya kolam renang lainya bayar kisaran 5-20k
Rakhmaputri Tunjungsari,4,5 tahun lalu,,"Tempat yang sejuk, cocok sekali untuk wisata dengan keluarga dan teman. Bagi anak-anak yang berenang setelahnya harus segera bilas dengan air panas karena kondisi cuaca dan air kolam yang dingin, dikhawatirkan anak-anak menggigil. Untuk mencari makanan yang hangat ada pop mie seharga 10 ribu. Bisa juga membawa makanan dari rumah, jadi seperti piknik, jangan lupa membawa tikar."
Vall Hana,4,6 tahun lalu,,"Tentu saja, yang jd andalan Selecta adalah pemandangan khas pegunungan yang asri. Dr atas, kita dapat melihat seluruh taman bunga dan wahana permainan. Tiket masuk pun murah (weekend 35k/orang). Parkir mobil pun dikenai biaya sebesar 10k. Untuk dapat menikmati wahana permainan, harus membeli tiket di loket yang disediakan. Sky bike: 20k/sepeda (1 sepeda isi 2 orang) Naik kuda: 15k Perahu ayun: 10k/orang Cinema 4D: 10k/orang Kiddi ride (khusus anak): 5k Dan ada juga flying fox, kolam renang anak dan dewasa, tentu saja dengan papan luncur yang tinggi dan menantang adrenalin. Ada juga taman bunga yang menyediakan bunga2 berwarna-warni. Saat Anda menaiki sky bike, maka pemandangan yang indah tersaji untuk memanjakan mata. Tak lupa juga tersedia mushola, toilet umum, dan pujasera. Tapi, suasana jadul Selecta masih terasa, dan berbeda dengan Jatim Park 1-3."
Raha Sia,5,5 tahun lalu,,
Dian Kusuma Fadila,5,3 tahun lalu,,Sudah ke tempat berkali-kali tapi memang tempat ini cocok buat rekreasi keluarga sih. Kalo weekend selalu rame. Tapi emang secocok itu buat refreshing sekeluarga. Wajib naik sepeda layangnya 👍 …
devita Sari,4,setahun lalu,,Masih menjadi tempat yg wajib di kunjungi kalau ke batu. Ada kolam renang buat dewasa dan anak anak juga.
Ardanyst,5,11 bulan lalu,Hari biasa,"Sejuk, tempat super bersih, luaaaaas, tenang. Highly recommended untuk wisata keluarga."
Renatha Gunstina,5,6 tahun lalu,,"Taman bunga yg sangat indah dan romantis.tempat liburan bersama kelg, org tua, anak, pacar, cucok juga buat syuting video romantis. ada 4kolam besar untuk anak. Ada sky bike (naik sepeda di langit), untang anting & mini roll coaster. Disediakan food court yg luas untuk melepas haus dahaga.buka dari jam 7pagi."
yessy na,4,setahun lalu,,Gak worth it kalo buat kamu yang cuma pengen liat liat aja. Aku kesini tahun lalu harganya lupa mungkin sekita 45 ribuan per orang.
angga ade sasmita,5,4 tahun lalu,,"sejuk indah udara segar apalagi waktu sore hari menjelang tutup, suasana gunung nya kena banget. tiket masuk kemarin 20rb per orang tambah tiket mobil 10rb. wahana yg kita coba becak air tiket 20rb sm biang lala 10 rb per orang. kolam renang ada untuk dewasa sm anak2 tp kmarin kita nggak nyobain kolam renang ny"
Arrazy Nurul Hidayat,4,5 tahun lalu,,"Tempat rekreasi cocok buat keluarga pakai tema piknik seru banget jangan siang2 ya kesiniya panas😅😅, didalam banyak tempat main untuk anak dan dewasa lalu ada juga kolam renang, dan kalau ga salah ada pemandian air panasnya juga di dalam. HTM 30rb perorang dan biaya parkir 10rb Parkir mobil nya luas, jadi jangan takut ga dapet parkir ...."
Safira N Ardhina,5,6 tahun lalu,,"Tempatnya luas. Cocok bersama rombongan keluarga. Banyak taman bermain dan area kolam renang. Dilengkapi kantin. Terdapat kuda bila ingin menaikinya bisa. Ada wahana rollercoaster mini, flying fox dan skybike. Tempatnya sejuk dan keren. Coba saja, pasti tidak akan menyesal. Untuk htm nya per orang 35rb. Parkir untuk sepeda motor 5rb."
Nur Rochman,4,3 tahun lalu,,"1. Di pintu masuk kita diwajibkan scan peduli lindungi 2. HTM 40k/org 3. Fasilitas cukup lengkap mulai dari penginapan, tempat parkir yang luas, tenant penjual oleh-oleh, restaurant, toilet dan tempat ibadah (musholah) 4. Untuk pengunjung prokes nya masih kurang 5. Cocok untuk berlibur bersama keluarga dan anak anak 6. Wahana permainan cukup variatif 7. Kolam renang juga ada 3 jenis 8. Overall bagus hanya saja kesadaran pengunjung tentang prokes kurang 9. Rambu informasi di lokasi juga cukup jelas"
Asroer Alaina,4,2 tahun lalu,Hari biasa,
Waskitho Wee,4,2 tahun lalu,,"Sebenernya sih tempatnya gitu² aja, taman bunga yang ada wahananya gitu, tapi harganya yang lumayan terjangkau (40ribu per orang) bikin tempat ini worthit buat rekreasi bareng keluarga, ditambah dinginnya kota batu, seger."
Maz Yoezmanto,4,6 tahun lalu,,"Tempat rekreasi keluarga ada taman bermain dan kolam renang serta ada sarana jogging track, namun sepertinya oerlu pembenanhan untuk tiket permainan harus beli lagi di dalam seharusnya bisa beli tiket terusan di awal pintu masuk, untuk tempat parkir juga cukup luas. Toilet yang dekat masjid sebaiknya ditambah tenaga pembersih agar lebih wangi lagi. Satu hal yang penting untuk para pengunjung tolobg buanglah sampah pada tempatnya, sedih lihat wahana alam penuh sampah...."
devanni.,4,2 tahun lalu,,
Nilam Nas,4,3 tahun lalu,,"Sekarang terdapat wahana baru yaitu bianglala dan roller coaster kecil. Tiket masuk weekend mqupun weekday 40.000 Perosotan di kolam 4 meter kurang safety karena menggunakan bahan plat, bahaya kalo nyangkut. Pas kemarin kesana ada orang kakinya kena kayu yg di pinggirannya kalo kata orang jawa 'tlusupen' saat perosotan."
Maya Christina,5,5 tahun lalu,,"""Selecta"" ... Siapa yang tidak kenal tempat wisata yang satu ini. Tempat Wisata Lama di Batu Malang yang terus menunjukkan kualitasnya sebagai salah satu tempat wisata saat liburan tiba. Dulu waktu kecil saya sering banget ke Selecta, bahkan acara perpisahan SD pergi ke Selecta dan Sengkaling. Pernah juga liburan bersama keluarga besar ke tempat ini. Setiap kesini pasti naik kuda, renang. Dan ternyata sampai tahun 2019 pun masih tetap sama. Yg berbeda ada beberapa tambahan spot2 baru. Ada beberapa wahana bermain baru, tetapi kolam renang dan area berkudanya masih tetap ada. Buat kalian yg berlibur ke Batu Malang... Wajib pake banget mampir ke Selecta ❤❤ #mmc26story #mmc26adventure #selecta #batumalang"
Rikhsan Kurniatuhadi,5,7 tahun lalu,,
Danxia Arshita Mayca,5,5 tahun lalu,,"Sdh banyak perubahan mulai dri kolam renang anak, tamannya n banyak mainannya. Masuknya bayar 35.000 dan mobil 10.000. Klo masalah bakso rata"" 15.000 minumannya panas atau dingin 10.000 itu harga perbulan juli 2019."
IPOET CHANNEL,5,2 minggu lalu,,Tempat rekreasi yg sangat cocok buat liburan bersama keluarga
Diva Emilya,4,6 tahun lalu,,"Oiya walaupun siang hari, udaranya tetap dingin jadi usahakan memakai baju hangat setelah berenang :) oh ada penjual jagung bakar jugaa.."
muhammad irfan,5,5 bulan lalu,Hari libur nasional,Pemandangan dan udaranya imdah dan sejuk
Yuni Nainggolan,4,6 tahun lalu,,
"Sofiandi, S.Pd.I",5,6 tahun lalu,,"Harga tiketnya 35.000 per orang. Anak usia 2 tahun ke atas dikenai tiket juga. Harga sudah termasuk menikmati pemandangan dan mandi di kolam renang. Sedangkan untuk menaiki wahana permainan dan lain-lain masih dikenai biaya tersendiri. Suasananya romantis, udaranya sejuk, tersedia tempat ibadah dan parkir yg luas."
Trie Yantini,5,2 tahun lalu,,"Tempat nya sejuk asri, cocok banget buat piknik keluarga.. Tempatnya juga bersih.. Tiket masuk 40rb.. Anak2 umur diatas 2th udh kena biaya masuk yaa... Tapi puas sih, tempat momong anak, bis berenang sepuasnya.. Klo yg dr luar kota, mungkin lebih mempersiapkan pakaian tebal aja, krn disana dingin bangeettttt . Klo abis berenang, pengen mandi air panas juga ad, biaya nya 5rb per orang"
Rudy (Sam Idur),5,7 tahun lalu,,"Berbagai wahana baru tersedia ditempat ini,tiket masuknya terjangkau,untuk weekend Rp.30000. Fasilitas yang tersedia antara lain kolam renang dewasa,kolam renang anak,play ground,outbond dan masih banyak lagi. Disini juga menyediakan tempat pertemuan/convention hall"
Si Jason,5,7 tahun lalu,,
Laela Nur Fitria,5,5 tahun lalu,,"Taman rekreasi ini cocok untuk liburan keluarga. Taman yg sangat luas, kolam renang yg luas. Pastinya akan membuat liburan bersama keluarga menjadi lebih menyenangkan. Fasilitas disana jg lengkap. Ada toilet, mushola, mini market, dll. Selamat berliburan..."
Hammid Setiawan,3,6 tahun lalu,,
Yevv Moon,5,10 bulan lalu,Hari biasa,"Taman bermain untuk kelurga dan teman"" di kota batu, udara sejuk dan tempat parkir luas"
DEBY K,5,2 tahun lalu,,"Tiket masuk 40000, mobil 10000, jangan lupa karcis mobil di simpan, nanti pulang ditanyakan lg, buat scan buka portal Bersih, luas Tempat nunggu di kolam renang kurang nyaman"
DEWI MAR'AH SOLICHAH,5,5 tahun lalu,,"Taman Selecta makin indah makin keren banyak sekali macam bunga yang ditanam, ada juga berbagai mainan, spt sky bike roller coaster dan kapal ayun(😁) kolam renang yg byk sekali dll, mantab pokoknya.. …"
Karisma Beliebers,5,5 tahun lalu,,
Agnita Damaria,4,6 tahun lalu,,Tempatnya bagus... Konturnya naik turun agak berat untuk manula... Spot untuk beristirahat dan berteduh kurang. Jadi kalau musim hujan agak merepotkan.
